GO Term,Description,P-value,Genes
GO:0043167,ion binding,3.26e-14,"CACNA2D3, DHX30, USP32, EYS, ZNRF2, CTDSPL, USP13, TRERF1, ZNF621, CNGB1, ADCY10, ABAT, ESCO1, JAK1, ABCA1, PCSK6, LIMD1, ABCF1, GALNT13, RNF130, ABCA4, PAFAH1B1, ABL1, KALRN, ABL2, GALNT8, SALL2, ACACB, FREM1, MYO18B, GBGT1, PAK2, HIP1R, PXDNL, BAZ1B, ACO2, KCND3, ACOX1, CNDP1, PRUNE2, COL9A1, KCNH1, KCNJ1, ACTA2, ASH1L, FBXO11, NUGGC, KDM2A, SCP2, PCDH9, LIMCH1, ALPK1, RIMS1, ASH2L, KCNQ1, CHMP1A, RRAGC, PCP4, XYLT1, MAEA, ARL10, ADA, PDZRN3, GAK, KIF9, UHRF2, MYO16, KIFC3, PDE1A, ADARB2, TRIM45, KDM4B, GALK2, ADCY2, GALNS, ZNF2, PHLPP2, PDE4D, CAMP, KIF4B, SCUBE1, EGF, SULF2, ATAD2, EFHD1, NSFL1C, SDHB, FER1L4, FER, CPM, PPTC7, RAB3C, RAB3C, ATAD2B, ZNF23, ZSWIM8, KIF11, AGBL4, RNF166, GATA4, SETX, ARHGEF28, ENPP3, SWAP70, VWA8, RNF216, CBFA2T2, PLEKHA5, PCDHGA4, ZNF423, NR6A1, GREM2, ZNF90, PFAS, TUBB4A, ZDHHC20, SGCA, DGKI, FSTL4, ZNF605, CDH22, MYO3B, HCN1, ARAP3, DDX4, ZNF713, ZNF566, MAP3K13, ITSN1, ATP8A1, UHRF1, MYL9, CDK14, PEMT, ZNF836, GALNTL6, ZBTB16, CPQ, SHC1, RAD54L2, TEX14, NSMCE2, CPEB1, ZMYM4, SPON1, LAMC2, NECAB2, ABCB1, RNF17, ZMYM6, YPEL1, CSNK2B, ZNF780B, NCAN, LBR, MCM9, SEC24B, LCK, TBC1D9, PLA2G2F, ZMYM2, SKI, AGAP1, STAB1, ZNF891, MAGI1, ALK, TTLL12, SLC1A1, SLC1A2, SLC1A5, SLC1A6, GLI2, GLI3, CPXM1, GLO1, INO80, SMYD3, NME7, PRDM2, COLEC12, GALNT15, AMPH, GMDS, PARD3B, ZC3H4, SLC8A1, SLC9A1, GNAL, GNAQ, VAT1, SBK2, PRICKLE2, RNF144B, UNC13B, ABCC11, LPP, ZBTB8B, MMAA, PLCB1, PLCB2, EFCAB6, PHLPP1, LRP2, KLF4, GNL1, AOC2, KCNAB1, ASTN2, ATP11A, RNF11, LTBP1, SGK3, SLIT3, BAZ2B, TUT1, TPK1, APLP2, BNC2, DDX39B, APOB, CPXM2, FSTL5, LYN, ATP2C1, SLIT2, HUNK, SMPD1, RANBP17, SLC30A8, LONP1, RAB28, RAB28, IDO2, PMS1, ZFHX2, SMG6, MGRN1, NRXN3, DGKG, ZFYVE9, NRXN1, OIT3, SCAPER, PAK6, POLD1, LIPG, ARG1, MAN2B2, GRK5, DUS3L, SOD1, CA10, DCTD, CDK15, GLRA3, PDE7B, MAN2C1, RHOH, ARL2, TRIM3, MLLT10, ZNF664, POR, CPNE7, ITSN2, SP3, DHX9, WNK1, ZCCHC2, PCDH15, DHX15, MATK, NAV3, PPARA, MPPE1, PPARG, ARHGAP35, PRDM10, FGD4, GRM7, ASAP1, AK3, ALKBH2, CDKAL1, SIK3, ZSCAN18, PLCZ1, GSK3A, ADAMTS16, SPTBN1, ADAMTS17, ZFHX3, SRC, SRD5A1, DPF3, FARS2, ROCK2, RHO, ZNF721, CABP1, GNA13, RARS2, SPOCK3, CLPB, ATP1A3, CRB1, ATP1A4, MSH6, COLEC11, KIF23, CCT6B, ATP2B1, MAP3K4, MAP3K5, ADAMTS2, ACSBG2, DMRT1, NDUFS7, DDX50, DNA2, POLQ, GUCY1A2, GALNT18, SPTLC2, DNAH8, MGAT1, ATP6V1B1, PDLIM3, STAC, MGAT5, DNM2, ZNF616, ZNF544, DNMT3B, CAMK1D, ZNF710, PTGES, CIITA, PRKAR1A, CAMP, EFCAB5, DPEP1, AGBL1, RAB3D, RAB3D, ATR, PRKAR1B, CAMP, SYN3, ZSCAN2, ATP9B, PRKCA, DPYD, AURKA, PRKCE, MACF1, ADCK1, ZBTB7B, PRKCSH, ST8SIA3, AGO3, PRKCZ, RABGEF1, PRKDC, MAP3K9, MAPK1, NR1D1, MORC3, STK39, KMT2A, MAPK4, ZNF274, ZNF367, BARD1, CDC42BPB, MAPK9, KAT6B, MAP2K1, EPX, MAP2K5, CREB5, DTNA, DTNB, PICALM, SEC24A, SVIL, CANT1, ZNF93, BRAP, TNNI3K, MAST4, PITPNM3, PSD4, SYT1, CDH20, ADPGK, ADIPOR1, DYRK1A, CELSR1, AATK, FAXDC2, GNA14, PRSS3, SNX14, CLCA2, PADI4, PRDM1, ZNF592, BLM, ZNF251, KIF26B, ACSF3, SOBP, PSD, MICAL2, DDX58, BMP1, ZNF534, ZNF578, TAP2, L3MBTL4, CYP46A1, ZNF516, ANO1, AICDA, PHC2, USP20, IRAK4, ZNF626, DST, ACER1, TBXAS1, ZNF813, RAB10, RAB10, PIP5K1A, PIP5K1B, MEGF8, HMGB1, RAPGEF2, EDEM1, NLRP5, CALN1, C2, TET3, ZNF569, PLCE1, ZBTB8A, CRISPLD2, NLRP12, DBF4, WTIP, RAB38, RAB38, RIMKLB, RNF220, HNRNPU, GLTP, ZNF608, ARHGAP32, TTF2, ACAP1, COIL, ZNF536, PM20D1, CA5A, ZNF385C, TAF3, GLIS1, HDAC4, ENPEP, CACNA1A, MIB1, CACNA1C, CACNA1D, HMCN1, EPB41, ALPK3, CACNA1S, CACNA2D1, PPM1D, ZBTB7C, TEP1, NAT10, PTPRS, KIAA0232, KIAA0232, EXOC8, CALB2, PDIK1L, HPCAL1, OGFOD1, BRD1, SLC27A2, CAPN13, EPS15, ERBB4, CAMK2A, PYGL, ERCC3, MX2, QDPR, GIT2, TGFBR3, HRG, GALNT14, WDFY1, RAB6A, RAB6A, RAB31, RAB31, EBF4, ADAP1, TMEM184A, ESR1, RABGGTA, MOB1B, TRIM14, SIK1, UBE2W, PITPNM2, CASQ1, MYH11, ACOXL, ZEB2, RAD51C, DNER, GADL1, TIMP2, TSHZ3, GAB2, GRB2, C2CD5, QPCT, MYLK, RUNX1, MYO1D, ZNF276, EWSR1, HSP90AA1, MYO5B, MKNK1, EXT2, AGMO, MYO7A, MYO9A, EP400, RAP1B, RAP1B, TLL1, MYO10, UBR5, HSPG2, RARA, DHX37, FCHSD2, RNLS, TLK1, HIPK1, TSHZ2, DDX46, SMYD1, ADAMTS5, USP44, MGAT4C, RHOBTB1, RHO, COMMD1, HTR3A, KLF7, PCGF6, NUDT7, CIT, ZNF345, STK32B, TECPR1, VAT1L, TP63, PUS10, RCN2, DNAH17, POLR3A, CPNE5, ATP2C2, ZNF517, FBLN2, NDUFAB1, REV1, REV1, NLRC5, MCM10, POLR1A, NARS2, REV3L, HELZ, SCARB1, RFC2, TPD52, MTHFD1L, TTLL6, IDE, ZNF385D, DNAJA4, SCUBE2, EGF, OXSR1, CD44, EIF2AK4, NUDT4, DIS3L2, FOXP2, TRPV6, NELL1, ZNF521, CXXC5, NR2C2, MCTP1, FER, VWA2, ACBD4, USP3, BAZ1A, FGF1, IQCA1, MAP4K5, THRAP3, ATP13A4, RIT2, CPNE9, DNAH11, NR1H4, CDC6, CDC42, ZNF823, FGFR2, TNK1, FLYWCH1, NUDT13, ABCC3, FGR, HDAC7, CDC42BPG, ZNF821, CDH8, DNAH3, IGF1R, EHMT1, AKAP13, NFX1, STAB2, CTDSP1, CDH13, MOB3B, CDH15, RNF4, GBF1, DNAH1, PIAS4, RNF6, FGD5, BMP2K, RIPK1, ABCC12, TANK, OVOL2, ZNF462, TRIM71, NQO2, KMT2C, RNF152, EPS15L1, NEK11, FLT1, SIGLEC5, ZNF407, WIZ, FLT4, DAB2IP, SLC38A9, NWD1, TNFRSF11A, TRIM67, DCAKD, JMJD1C, EVA1C, NLRP2, HACL1, ZSCAN22, NLK, PADI3, ATP9A, PRDM12, CDKL1, TYROBP, CPNE2, EDIL3, EGF, UIMC1, PLCD3, CMPK1, CHD2, RAB11FIP4, ZNF726, PRSS57, RNF13, MREG, LGR6, NRP1, UBE2D2, ABLIM2, UBE2E2, EPHA10, ATP8A2, CHN2, NTRK3, IKZF3, KIF6, ZNF326, ROR1, ROR2, ABCA13, DDR2, CHRM3, RSF1, RSPO4, EFCAB8, NUMA1, IMPDH1, RASA3, ZBTB20, GALNT7, CHRNB3, N4BP2, ABCA12, HHAT, ZFP64, UCK2, SGPL1, PPM1E, LRP1B, INSR, JAZF1, CHFR, SVEP1, CLCA1, COL25A1, MTMR3, PITPNC1, CLCNKB, UTRN, CDHR4, ARL5A, RSBN1L, EXOC1, CACNA1H, RRM1, ZHX2, TNK2, CLSTN1, TIRAP, ITGAE, ZNF556, BSN, TSHZ1, VDR, VEGFB, CLVS1, RYR1, RYR2, GALNT11, RYR3, CSGALNACT1, ITGB7, ARSG, VLDLR, TUBA4B"
GO:0008092,cytoskeletal protein binding,2.11e-13,"WIPF2, TUBGCP5, ARHGEF10, KIF26B, NEBL, CNN3, MICAL2, PAFAH1B1, ABL1, ABL2, TTLL6, XIRP2, MYO18B, LYN, ARPC1A, HIP1R, TBCA, CORO1C, NEFH, PAWR, WT1, TBCD, MTUS2, DST, IFT74, NDE1, CLMN, RAB10, RAB10, DIXDC1, PPARGC1A, BCAS3, KBTBD13, FHOD3, FHDC1, SORBS1, FRMD3, RABGAP1, VASH2, LIMCH1, KCNQ2, CTNNAL1, DCTN1, CLASP1, MAEA, PALLD, KIF9, KIFC3, MYO16, SYNE1, EPS8L1, EPS8, MAP4, AATF, NCK2, MAP6, PPP1R9A, KIF4B, SSH1, HNRNPU, FMN1, ADD3, NAV3, JAKMIP1, MTUS1, RAB3C, RAB3C, PPARG, PTPN3, KIF11, PTPN4, AGBL4, FGD4, CCSER2, SORBS2, HOMER2, MYOZ3, GSK3A, CACNA1C, CACNA1D, SPTB, EPB41, SPTBN1, PHACTR3, EPB41L2, CRMP1, COTL1, ROCK2, RHO, AP1G1, RCSD1, ENC1, MTSS1, PPP2R2A, CORO7, CALD1, SYNPO2, DLG1, CTNNA3, KIF23, MYO3B, EPS8, ARPC3, MYL9, GAS7, AFAP1, MX2, ABLIM2, TMOD4, STXBP5L, MYBPC2, EPB41L3, PROM1, DIAPH3, KIF6, DNASE1, RAB6A, RAB6A, PARVB, CAPZB, NUMA1, PDLIM3, DNM2, DIP2B, SPTBN5, MYH11, PHACTR1, TIAM1, MAGI1, AGBL1, RAB3D, RAB3D, WHAMM, SHROOM3, MYLK, TTLL12, FRMD5, MYO1D, PRKCE, HSP90AA1, MACF1, FARP2, DAAM2, MYO5B, CEP350, HOOK1, MYO7A, MYO9A, MYO10, INO80, FARP1, RARA, CTNNA2, WASF2, CYFIP1, USH2A, UTRN, OPRM1, EML4, EML6, PACRG, PICALM, CLSTN1, SLC8A1, SVIL, ANK1, ANK2, WASF3, TNNI3K, SYNE2, PTPRT, DYRK1A, TNNT1, MYPN"
GO:0003674,molecular_function,1.87e-12,"USP32, SLC29A4, NAT1, ZNRF2, CTDSPL, ABAT, ABCA1, PCSK6, ABCF1, ABCA4, PAFAH1B1, ABL1, ABL2, ABR, SERPINE1, DEFB119, ACACB, PAK2, MYO18B, PALM, PAWR, WT1, TSPEAR, ACO2, ACOX1, CNDP1, PBX1, ACTA2, SLC17A8, PBX3, STAG1, PCDH9, PCNT, CHMP1A, PCP4, PCSK5, MAEA, GDAP1, ADA, PDE1A, ADARB2, ADCY2, TMEM9, PDE4D, CAMP, SSH1, ADD3, LRCH3, PDGFRL, RIN2, ATAD2B, TMEM25, AGBL4, CCSER2, XRN1, ENPP3, EPHX4, RNF216, PLEKHA5, CACNG2, AP1G1, RBM47, CERS6, PFAS, TUBB4A, CPVL, ZDHHC20, DDX4, PUS7, ZNF566, VIT, APBB1IP, DLC1, AGTR1, ATP8A1, MYL9, CDK14, PEMT, EXOC6, CPQ, LTV1, SPON1, NECAB2, ABCB1, CGNL1, MCM9, SEC24B, CFDP1, PROSER2, PHKB, SLC41A1, TOX2, OLFM1, N4BP2L2, ALK, FRMD5, NAALADL2, RBM17, INO80, PIBF1, PIK3R1, AMPH, CROT, ANK1, ANK2, RBFOX1, PKNOX1, VAT1, RASGEF1C, OTUD4, RNF144B, UNC13B, ABCC11, SEMA6C, ZBTB8B, PLAT, SEMA4D, PLCB2, APPBP2, MYBBP1A, AOC2, PLCG2, FAM20A, PCSK4, APBA2, APBB1, APBB2, NEBL, ATG7, DNAJB12, APLP2, BNC2, APOB, FAM155A, SLC22A16, ARPC1A, AHI1, TCERG1L, PMS1, ZFHX2, NDE1, DISP2, DIXDC1, BCAS3, FHDC1, TACC2, SORBS1, FRMD3, CATSPERD, POLD1, ARG1, RHOH, ARL2, ST6GALNAC2, TRIM3, POR, ANKRD13A, EPS8L1, EPS8, QRICH1, PIGG, POU2F2, ZCCHC2, ART3, TAF6L, TAF6, CWC25, PPARA, NAV3, PPARG, MED1, NSUN2, LEFTY1, IGF2BP3, ELOVL2, IGF2BP2, FCHSD1, CUEDC1, CDKAL1, PLCZ1, PPL, SLC25A21, KHDRBS1, FOCAD, ZFHX3, ATF3, CD226, FARS2, PAPLN, GNA13, ATP1A3, PPP2R2A, B3GNT2, ATP1A4, NPHP4, UBE3D, PPP2R5B, PPP2R5C, CCT6B, ATP2B1, KCNH7, NRG3, TXNL4B, POLQ, UNC5A, ATP6V1B1, BANP, HS6ST3, ZNF616, PRKAB1, EXOC3L2, PRKAR1A, CAMP, ATR, PRKAR1B, CAMP, ZSCAN2, PRKCA, PRKCE, ATP6V1E2, PAK1IP1, B2M, PRKCSH, PRKCZ, PRKDC, MAPK1, MAPK4, YIF1B, ZNF274, BARD1, MAPK9, MCU, PID1, MAP2K1, PHIP, BCAT1, MAP2K5, BCL2, STARD13, STAR, SEC24A, BCL3, SDCCAG8, WASF3, BCL9, IFNL1, BDH1, BDKRB1, FAXDC2, BFSP1, PRSS3, OXR1, PRDM1, BLM, KIF26B, ZNF251, SOBP, PSD, BMP1, BMP6, CYP46A1, L3MBTL4, LILRB1, ANO1, IGFN1, TSPAN9, USP20, PLEKHJ1, PSMB2, DST, NEAT1, RAB10, RAB10, SRBD1, PPARGC1A, BTF3L4, PSMD8, COL23A1, ARHGEF10L, C2, C3, DBF4, NLRP12, CAPN5, SPIN1, OTOGL, RNF220, B4GALNT3, CABLES1, NXPE3, LDLRAD4, CBX1, WDR20, PTPN3, PTPN4, PLEKHG6, PTPN6, CA5A, SETD5, PTPRD, MYOZ3, CACNA1A, PTPRE, CACNA1C, PTPRG, CACNA1D, PTPRJ, UQCR11, CACNA1S, PTPRM, CACNA2D1, PTPRN2, PTPRO, PTPRS, CCNI, NAT10, MTDH, CALB2, RCSD1, OGFOD1, CALD1, SLC27A2, CAPN13, LILRB4, TMEM132C, CAMK2A, PYGL, QDPR, SPSB4, CHMP4C, LILRA2, RAB6A, RAB6A, VPS53, RAB31, RAB31, CAPZB, ADAP1, RABGGTA, CASP2, MOB1B, PRTG, UBE2W, CASQ1, SLC35D2, ACOXL, RAD51C, FBXW7, DNER, RUNX1, RALGDS, ZNF276, RAP1B, RAP1B, ADAMTSL1, RAP1GAP, RARA, RNLS, RASA1, CCND3, RB1, ADAMTS5, NUDT7, CIT, STK32B, CD247, PTPRT, RCN2, FADS6, POLR3A, TBC1D8, MCM10, REN, REV3L, SCARB1, RFC2, TTLL6, DNAJA4, RFX3, CD44, NUDT4, EIF2AK4, FOXP2, PSIP1, TRPV6, RGS7, BAZ1A, MAP4K5, LRRC4B, LRBA, RIT2, CDC6, CDCA7L, CDC25C, SFXN5, CDC42, ZNF823, KCTD1, CDC42BPG, ZNF821, CDH8, RNASE4, DNAH3, AKAP13, STAB2, CDH13, SSC5D, CDH15, RNF4, RNF6, CHRNA9, BMP2K, ABCC12, PLIN5, PPP1R9A, STAP2, FILIP1L, TTC27, WDR62, ROBO2, ZNF407, FLVCR2, NWD1, SCN11A, BTBD2, TRIM67, MRAP2, ODF3L2, VPS45, SHISA9, NLRP2, HOGA1, ECD, RPL7, RCBTB2, PLCD3, MTFR2, CHD2, AHNAK2, ZNF726, RNF13, MREG, MGLL, FRMD4A, CASC3, EPHA10, LARP4, CHN2, IKZF3, ZNF326, RPL38, MTHFD2L, CHRM3, CHRM5, RPLP1, TENM3, RASA3, POLR3E, CHRNB3, N4BP2, HHAT, ZFP64, DLGAP4, PPM1E, CHFR, AP2S1, NTNG1, CLCA1, CLCN2, FNDC3A, TMEM30A, CLCNKB, NLGN1, TTC17, EXOC1, PLEKHA6, INPP5F, RRM1, TBC1D23, ZHX2, CLSTN1, TIRAP, CLTA, UNC80, BAHD1, DIS3, RYR1, CEP164, RYR2, RYR3, CSGALNACT1, ARSG, RUFY3, SBNO2, CACNA2D3, DHX30, TUBGCP5, TRERF1, ZNF621, CNGB1, TMEM132B, ADCY10, ESCO1, CNN3, HABP4, RNF130, GALNT13, SAFB, SORCS1, CNR2, SALL2, CNTN1, SHANK2, SLAMF6, COL4A2, OSBPL6, ATXN1, COL6A2, COL9A1, COL9A2, TMEM165, FBXO32, TMEM123, DIP2C, ASH1L, KDM2A, SCP2, TTC39A, LIMCH1, RIMS1, MAPKBP1, CNOT1, CCR4, ARL10, KIAA0825, KIAA0825, PALLD, TVP23A, TMCC1, DTWD2, PDZRN3, UHRF2, MYO16, KDM4B, PHLPP2, KIF4B, SULF2, SDC4, AJAP1, NSFL1C, MON2, SDHB, CPM, FNBP1, KLHL7, RAB3C, RAB3C, SEC14L1, ZSWIM8, SEL1L, RNF166, SETX, CREB1, SWAP70, VWA8, PPRC1, PHACTR3, ERC1, CRMP1, EXPH5, PCDHGA4, ZNF423, SRSF3, SFTPC, MCF2L2, SGCA, FSTL4, SGCG, RAP1GAP2, NFASC, ITSN1, GALNTL6, SHC1, RAD54L2, EPB41L3, TEX14, NSMCE2, RNF17, ST6GAL1, ST3GAL4, CSNK2B, ST8SIA1, NCAN, SIM1, TBC1D9, SKI, KIAA1217, KIAA1217, STAB1, ZNF891, AGAP1, SLC1A1, TTLL12, SLC1A2, SLC4A3, SLC1A5, SLC1A6, LRRC8A, CPXM1, RFTN1, CTBP2, KANK1, CTNNA2, CYFIP1, GANAB, CTNND2, PRMT8, GALNT15, DNAJC12, SLC7A2, PARD3B, ZC3H4, SLC8A1, CUX1, SLC9A1, CXADR, SLC9A3, SYNE2, VPS13A, KCNK13, PLCB1, MUC13, PHLPP1, SLC20A2, PDS5A, ASTN2, ATP11A, KAZN, SLIT3, ILDR1, CAMTA1, SMARCC1, PNLIPRP3, LIN9, CDC42SE1, CPXM2, FSTL5, CLEC16A, KLHL18, SMPD1, FAM149B1, MTUS2, WWC1, DAB1, ANKS1B, SMG6, MGRN1, SH3GLB2, DGKG, STARD7, STAR, IFT46, MEIS3, NXPE2, PAK6, DCC, MAN2B2, DUS3L, SOD1, CA10, DCTD, NEDD4L, SASH1, TTC28, ARNTL2, DCTN1, CLASP1, SOS1, SOS2, SOX5, SYNE1, DOCK9, NIT2, TMEM132D, SP3, IGFL4, DHX9, SP100, DHX15, STOX2, PRDM10, PRDM11, DFFA, FGD4, BTBD11, ANO4, ALKBH2, SIK3, MED13L, ZDHHC17, TEX29, SPTB, SPTBN1, SRC, SRD5A1, COTL1, NQO1, SREBF2, RARS2, CRB1, DLG1, DLG2, GRIP1, FRMD6, DMRT1, SLC35A3, DNA2, SLC44A1, DNAH8, AVEN, DNASE1, PDSS2, STAC, SLC24A4, DNM2, DNMT3B, STAT4, CAMK1D, SENP8, DOCK1, STAT5B, DOCK2, LPAR5, SEC11A, DPEP1, AGBL1, WHAMM, FSD2, DPP6, DPYD, AURKA, MACF1, RGL3, DAAM2, DNAAF1, ADCK1, ARHGEF33, KCTD2, SPATA33, LYZL6, ARID3A, SPIDR, MORC3, DSCAM, GPR139, KAT6B, DTNA, DTNB, MSI2, SVIL, CANT1, ADAMTSL3, SYCP1, RBFOX2, USP43, SYT1, PSD4, DYRK1A, TACC1, TACR1, ERGIC1, E2F3, TADA2A, CLDN14, SLC43A2, TAF4B, SNX14, PADI4, GGT6, TAF12, AFMID, DDX58, TAP2, FAM210A, OPN3, AICDA, PHC2, TBCA, CORO1C, TBCD, RAVER1, KCNK18, ACER1, EFNA1, EFNA2, TBXAS1, EFNA5, ZNF813, BIRC6, MEGF8, HNF1A, KPNA6, JOSD2, TCF3, TCF7L2, RABGAP1, PPM1H, GCFC2, GC, NLRP5, SCAF4, SSBP3, EIF4EBP1, TCOF1, STX12, OR1I1, WTIP, ARID1B, RAB38, RAB38, RIMKLB, ZNF608, CADM1, GABPB2, MTUS1, XPO5, HECW2, SRGAP1, TMEM245, MSL1, ENPEP, TDGF1, AIPL1, TBC1D14, MIB1, SLC44A3, TEAD4, EPB41, SORCS2, ALPK3, EPB41L2, TEP1, PISD, OSBP2, TFAM, TYW3, USP35, TFAP2E, BRD1, EPS8, EPS15, SIPA1L2, BCL2L13, BCL2, TCEANC2, ERBB4, DOCK6, ERCC1, ERCC3, ERCC4, KCNT1, TGFBR3, SHC2, WDFY1, EBF4, TBC1D22A, ESR1, BAHCC1, GOLT1A, THPO, PITPNM2, DIP2B, ETV1, TIAM1, GADL1, TIMP2, TSHZ3, QPCT, SHROOM3, EWSR1, DPP10, EXT2, TLE1, EXTL1, EP400, TLL1, ATXN10, DHX37, TSPAN4, GPR137B, TSHZ2, MGAT4C, ABTB2, TNF, ZNF345, TECPR1, VAT1L, ARMC8, LRRC4C, TNNT1, CPNE5, TNR, ZNF517, FBLN2, POLR1A, KIAA1614, KIAA1614, POC1A, SFMBT2, PLEKHG4, TPD52, MTHFD1L, XIRP2, AHCTF1, SCUBE2, EGF, DIS3L2, ZNF521, NR2C2, FER, VWA2, FGF1, WWTR1, FGF14, SGPP2, GPC5, FGFR2, NUDT13, FGR, FHIT, CTDSP1, DNAH1, OVOL2, TENM4, ZNF462, FMN1, TRIM71, KMT2C, ATXN1L, PKD1L3, EPS15L1, FLOT2, TTC1, FLT1, IPCEF1, WIZ, FLT4, SIPA1L1, SETBP1, COL6A6, CNTNAP2, PPP1R16B, AUTS2, EVA1C, ERC2, HACL1, CACNG7, ZSCAN22, SIGIRR, PRDM12, TYROBP, HERC4, LGR6, UBE2D2, AFAP1, UBE2E2, SLC9B2, UBE2V2, BACH2, RSPO4, UPK1B, MRPS35, ZBTB20, FASTKD5, CCDC81, UGDH, ABCA12, UCK2, STARD4, STAR, SAMD7, PITPNC1, TMPRSS7, SLC22A23, USH2A, UTRN, ARL5A, UVRAG, TIAM2, PACRG, SH2D4A, VDR, VEGFB, VEGFC, GALNT11, VLDLR, FBXO22, EYS, SVOPL, SVOP, SACS, EIF4H, GALNT8, ADAM2, GBGT1, NPAS3, PXDNL, SLC37A4, GAA, NPFFR1, GABRB2, INTS6, RRAGC, GABRR1, GABRR2, AGO1, XYLT1, GAK, KIF9, GALK2, GALNS, ZNF2, AATF, CATSPER3, DNAJC1, ZNF23, MS4A6A, GATA4, ARHGEF28, CTU2, NXN, NR6A1, CHST8, GREM2, ZNF90, ZNF605, CDH22, MYO3B, HCN1, ARAP3, ZNF713, MTMR14, CHODL, GFRA3, ZBTB16, CPEB1, BRI3BP, SOGA1, ZMYM2, PLA2G2F, MACROD2, GLI2, GLI3, GLO1, RILPL1, SMYD3, PRDM2, TNS3, PTP4A1, GMDS, S100PBP, PCED1A, PC, FNDC3B, GNAL, NANP, GNAQ, CRTC3, GINS3, GNG7, EFCAB6, NBEA, POLN, GNL1, IL25, KCNAB1, FBXL17, GOLGA4, RNF11, GOLGB1, FETUB, SGK3, SLC13A3, TUT1, TPK1, SLC34A3, KCNV1, PRRC2A, GPI, BAG6, BCL2, DNAI1, GPM6A, DDX39B, ABHD16A, METTL4, RAD21L1, RAD21, ATP2C1, MPP7, RANBP17, VTI1A, PELP1, STAU2, MRPS6, MRPS5, ST6GALNAC4, CACNG5, CLUL1, GRK5, TUSC3, PLEKHA7, CDK15, GLRA3, PDE7B, SLC2A14, GRB10, RAPGEF1, MLLT10, ZNF664, CPNE7, SLC25A16, GRID2, GRIK1, WNK1, GLT1D1, DENND2A, PCDH15, GRIK4, CPAMD8, KRT80, CUL5, GRIN2C, A2ML1, GRIN2D, MPPE1, ARHGAP35, MFAP5, RAD9B, GRM6, GRM7, GRM8, ZSCAN18, GSK3A, DDRGK1, DPF3, GSTA4, TMEM108, SLC38A6, MSH6, COLEC11, BBS9, TTC7B, AHDC1, LRFN4, ERLEC1, SLC14A2, LSM1, NDUFS7, DDX50, GUCY1A2, GALNT18, AHNAK, NRG4, PDLIM3, NCOA3, ZNF544, RBMS3, ZNF710, SECISBP2, EFCAB5, SYN3, TRPM8, ATP9B, TNRC6A, GSG1L, GSG1, METTL16, IL34, UTP20, UTP20, RABGEF1, STK39, RBFOX3, EPX, EML4, TRRAP, PICALM, RBM44, NDUFAF5, LHFPL4, AXIN1, BAP1, BRAP, NRROS, CCDC28B, MAST4, FKRP, CDH20, HDLBP, HEXB, WIPF2, HGF, NRG1, ZNF534, ZNF578, MAD1L1, TAF9, PIP5K1A, PIP5K1B, HMGB1, BCAR3, ZNF569, ONECUT1, NCK2, GNPAT, WDR25, HNRNPU, TTF2, TPST1, SUPT3H, PM20D1, SORBS2, SDHAF1, GLIS1, CNIH3, PPM1D, HOXC12, PPFIA2, EXOC8, PDIK1L, ENC1, HPCAL1, CORO7, GAS7, HRH1, CCNJL, HMBOX1, HRG, GALNT14, SIK1, HSD17B4, LGR5, ARMC7, HSF4, CDC14B, PRPF18, MCPH1, HORMAD2, RPAP3, HSP90AA1, ARHGAP10, MKNK1, SCARF1, HSPG2, NDST1, VTCN1, SMYD1, COMMD1, HTR3A, KLF7, PROM2, TP63, PUS10, ICA1, ICAM1, DNAH17, ANKRD55, IRF8, WDR59, NARS2, NUMB, IDE, EIF3D, ZNF385D, EIF3J, EIF4G3, MCTP1, ACBD4, PP2D1, IQCA1, KLHL36, CLMN, CPNE9, DNAH11, B3GALT1, TNK1, ABCC3, VASH2, TNFRSF25, MBTPS1, IGF1R, EHMT1, TLE6, CTNNAL1, MOB3B, SPICE1, GBF1, CMTM8, CKLF, CAMKMT, FGD5, RIPK1, CRADD, CNTN4, SH3D19, CCDC102B, JAKMIP1, NEK11, SIGLEC5, RBFA, DAB2IP, SLC38A9, RGS9, TNFRSF11A, DCAKD, IL1RAP, IL2RA, RIN3, FAM81B, CDKL1, PRELID2, NAA60, INPP4B, NRP1, SAMD3, MBOAT1, DOK3, KIAA0319L, KIAA0319, IL15RA, HDAC3, PROM1, TNFRSF9, ABCA13, EFCAB8, KAT2B, CLEC2L, IMPDH1, LDB1, WDR76, ATAT1, ARHGEF7, INPP5A, INPP5D, GRHL2, SGPL1, INSR, SVEP1, RBM33, EIF2B5, PEBP4, MTMR3, MTMR2, DOCK5, IRF2, RDH10, CDHR4, IRS1, WWC2, NAA25, CACNA1H, UBTD1, TMEM62, ERICH1, ITGAE, ZNF556, BSN, TRPM3, TMEM74, GPR157, SKAP2, CLVS1, KCNU1, ITGB5, FUBP3, TOP3B, SBSPON, ITGB7, ITIH2, TUBA4B, USP13, JAK1, VCPIP1, ATP6V0E1, LIMD1, KALRN, TAF1C, FREM1, HIP1R, BAZ1B, IFT74, KCND3, PRUNE2, KCNH1, KCNJ1, FBXO11, MAP7, NUGGC, FHOD3, SPG11, KCNJ16, DCPS, ALPK1, ASH2L, KCNQ1, MRPS18B, KCNQ2, CLDN6, KIFC3, TRIM45, GRPEL1, TMTC2, SCUBE1, EGF, SLC43A3, USP10, ATAD2, EFHD1, ALDH1L2, DENND5B, FER1L4, FER, PPTC7, CCDC60, KIF11, NDUFAF4, KPNA1, CCDC59, KPNA3, TIMM21, ARHGEF1, CBFA2T2, SEL1L2, CTDP1, PDCD1LG2, SLC28A1, TSGA10, DGKI, CTNNA3, SRCIN1, MAP3K13, UHRF1, BLNK, AFF3, ZNF836, TMOD4, LAIR1, TSEN2, LAMA3, ITIH5, PARVB, ZMYM4, LAMC2, ZMYM6, LRRFIP1, YPEL1, ZNF780B, LBR, LCK, CMIP, UBN1, MAGI1, APOL6, DLGAP1, TAS1R1, KANK4, NPL, HCFC2, WNT5B, PYCR2, NME7, COLEC12, LIPA, ALG6, ALG6, LMNA, OSGIN1, PRICKLE2, SBK2, LPP, SOCS6, MMAA, LRP2, KLF4, NREP, SCHIP1, LSS, LTBP1, GTF3C3, BAZ2B, OR4N2, OR4K2, CD180, LYN, PKD1L1, OR11G2, SLIT2, HUNK, CAPRIN1, SLC30A8, LONP1, COL22A1, RAB28, RAB28, IDO2, NRXN3, ZFYVE9, KBTBD13, MAFG, NRXN1, CDR2L, KLK14, OIT3, SCAPER, LIPG, NMT2, MAL, MAL, GRAP2, GRB2, MAN2C1, MED21, PABPN1L, MAP4, MAP6, ITSN2, NTN1, MATK, ARHGEF4, MBP, ASAP1, SYNC, MCC, AK3, HM13, HOMER2, SGPP1, RASAL2, GDPD5, TAS2R1, ADAMTS16, SH3BP5, ADAMTS17, AKAP6, KCNG3, ROCK2, RHO, CABP1, ZNF721, SPOCK3, CLPB, PIGL, SYNPO2, KIF23, TBX4, MEIS2, SHANK1, MAP3K4, MAP3K5, ADAMTS2, ACSBG2, GAL3ST1, STXBP5L, SPTLC2, DIAPH3, SHCBP1L, MGAT1, VMP1, TMEM59, MGAT5, ASCC1, PTGES, CIITA, NRG2, RAB3D, RAB3D, NETO2, SBF2, MITF, MKLN1, ZBTB7B, ST8SIA3, AGO3, MAP3K9, GABBR2, NR1D1, KMT2A, MLLT3, ZNF367, CDC42BPB, ENTPD4, ISG20L2, CREB5, AKAP12, SEH1L, PLBD2, ZNF93, TNNI3K, PITPNM3, MTRF1, ADPGK, ADIPOR1, CELSR1, AATK, ABHD5, GNA14, LCTL, CLCA2, GLT8D2, ARHGEF10, ZNF592, ACSF3, MICAL2, PLVAP, SOCS5, ASB3, ZNF516, CEP135, IRAK4, SAFB2, ZNF626, INSIG2, DEPDC5, CC2D1B, NUP93, RAPGEF2, EDEM1, PLD5, TEKT1, MSR1, TRAPPC9, CALN1, RAPGEFL1, TET3, PLCE1, CRISPLD2, ZBTB8A, SLC25A18, TMEM63A, SPRED2, DOCK4, USP34, GLTP, ARHGAP32, ACAP1, COIL, ZNF536, DHRS7C, ROPN1L, ZNF385C, TAF3, RSPH3, HDAC4, SLC39A11, HMCN1, ZBTB7C, KIAA0232, KIAA0232, PIEZO1, GOLM1, TIGIT, MTSS1, MUC2, SMIM14, PHYHIP, STARD3NL, MX2, CTIF, SFI1, MYBPC2, GIT2, TMEM184A, FAM172A, TSNARE1, TRIM14, EMILIN2, MYH11, ZEB2, SPTBN5, GAB2, GRB2, C2CD5, MYLK, MYO1D, SLC10A7, FARP2, MYO5B, KIAA0319, KIAA0319, ELFN1, CEP350, AGMO, MYO7A, HOOK1, MYO9A, MYO10, MAGI2, UBR5, PPP1R12A, FCHSD2, UCHL5, TLK1, ANGPT4, HIPK1, DDX46, AIG1, USP44, SLC41A2, RHOBTB1, RHO, NAP1L4, PCGF6, QRFPR, NCAM2, SV2B, SRGAP3, HEATR4, ANAPC7, SYDE2, ATP2C2, NDUFAB1, REV1, REV1, NLRC5, NDUFB7, LPGAT1, HELZ, CTDSPL2, OXSR1, CRYZL1, TMEM117, NEDD9, HS3ST4, DTL, NEFH, NELL1, HS3ST2, CXXC5, USP3, THRAP3, ATP13A4, NR1H4, VPS54, NFIA, FYTTD1, OR9Q1, NFE2L1, NFIC, FLYWCH1, NFIX, HDAC7, NFKBIL1, CASP8AP2, NFX1, PIAS4, TANK, NINJ2, GET4, SH2B3, DOK6, NQO2, RNF152, SH2D3C, FAM13C, NUB1, NPAS1, SARNP, JMJD1C, FAM171A1, PTPRU, NLK, PADI3, ATP9A, SPATA13, EDIL3, EGF, CPNE2, UIMC1, CARD11, UST, CMPK1, ARPC3, NRF1, RAB11FIP4, MAML2, TSPAN5, PRSS57, NRTN, WWOX, ABLIM2, LRRC73, LCOR, ATP8A2, NTRK3, INPP5K, KIF6, ROR1, ROR2, DDR2, RSF1, NUMA1, GALNT7, CNFN, PHACTR1, OCA2, LRP1B, JAZF1, PLXNC1, SDK1, FOXK1, CLIC5, FARP1, COL25A1, THSD7A, WASF2, OPCML, FXYD6, KIRREL3, SRRM3, RSBN1L, OPRM1, EML6, TNRC18, RBM6, ATXN7L1, AFAP1L2, TNK2, TSHZ1, A4GALT, CCDC62, MYPN, TMEM130"
