GO Term,Description,P-value,Genes
GO:0036094,small molecule binding,2.64e-06,"DHX30, GNA14, CNGB1, ADCY10, PADI4, ABAT, JAK1, ABCA1, BLM, KIF26B, ACSF3, ABCF1, MICAL2, ABCA4, ABL1, KALRN, DDX58, ABL2, TAP2, ACACB, PAK2, MYO18B, OPN3, OSBPL6, IRAK4, BAZ1B, ACOX1, KCNJ1, ACTA2, RAB10, RAB10, PIP5K1A, PIP5K1B, NUGGC, RAPGEF2, SCP2, ALPK1, NLRP5, RRAGC, ARL10, TET3, ADA, GAK, KIF9, MYO16, KIFC3, NLRP12, GALK2, ADCY2, RAB38, RAB38, GRPEL1, PDE4D, CAMP, KIF4B, RIMKLB, ATAD2, HNRNPU, RAB3C, RAB3C, TTF2, ATAD2B, KIF11, SETX, SWAP70, VWA8, ALPK3, TEP1, NAT10, KIAA0232, KIAA0232, OSBP2, PDIK1L, PFAS, TUBB4A, OGFOD1, DGKI, SLC27A2, MYO3B, HCN1, DDX4, MAP3K13, STARD3NL, ERBB4, ATP8A1, UHRF1, PYGL, CAMK2A, CDK14, ERCC3, MX2, QDPR, RAD54L2, TEX14, RAB6A, RAB6A, RAB31, RAB31, ADAP1, ABCB1, SIK1, UBE2W, MCM9, NCAN, LBR, LCK, ACOXL, MYH11, RAD51C, GADL1, AGAP1, STAB1, MAGI1, MYLK, ALK, RUNX1, TTLL12, SLC1A1, MYO1D, HSP90AA1, MKNK1, MYO5B, MYO7A, EP400, MYO9A, RAP1B, RAP1B, CTBP2, MYO10, INO80, RARA, DHX37, RNLS, TLK1, NME7, HIPK1, COLEC12, DDX46, GMDS, RHOBTB1, RHO, PROM2, GNAL, CIT, STK32B, GNAQ, SBK2, ABCC11, DNAH17, MMAA, ATP2C2, NDUFAB1, GNL1, NLRC5, KCNAB1, ASTN2, NARS2, ATP11A, REV3L, HELZ, SGK3, RFC2, TUT1, TTLL6, MTHFD1L, IDE, TPK1, DNAJA4, GPI, OXSR1, CD44, DDX39B, EIF2AK4, CRYZL1, LYN, ATP2C1, HUNK, RANBP17, CXXC5, FER, LONP1, ACBD4, RAB28, RAB28, PMS1, IQCA1, MAP4K5, THRAP3, ATP13A4, RIT2, DGKG, DNAH11, NR1H4, CDC6, CDC42, FGFR2, TNK1, ABCC3, PAK6, FGR, POLD1, CDC42BPG, DNAH3, FHIT, GRK5, IGF1R, DUS3L, STAB2, CDK15, DNAH1, GLRA3, RHOH, BMP2K, RIPK1, ABCC12, ARL2, POR, DHX9, WNK1, DHX15, MATK, NQO2, NAV3, PPARG, ARHGAP35, NEK11, FLT1, SIGLEC5, FLT4, GRM7, AK3, SIK3, NWD1, GSK3A, DCAKD, SRC, NLRP2, SRD5A1, HACL1, FARS2, ROCK2, RHO, NLK, ATP9A, GNA13, RARS2, CDKL1, CLPB, ATP1A3, ATP1A4, COLEC11, MSH6, KIF23, CMPK1, CHD2, CCT6B, ATP2B1, MAP3K4, MAP3K5, UBE2D2, UBE2E2, EPHA10, ACSBG2, DDX50, DNA2, POLQ, GUCY1A2, SPTLC2, ATP8A2, DNAH8, PROM1, NTRK3, KIF6, ROR1, ROR2, ABCA13, DDR2, ATP6V1B1, IMPDH1, DNM2, CAMK1D, UGDH, CIITA, N4BP2, PRKAR1A, CAMP, RAB3D, RAB3D, ATR, PRKAR1B, CAMP, SYN3, HHAT, ABCA12, ATP9B, PRKCA, UCK2, SGPL1, AURKA, DPYD, PRKCE, INSR, CHFR, ADCK1, STARD4, STAR, PRKCZ, ST8SIA3, PRKDC, MAP3K9, MAPK1, MAPK4, STK39, CDC42BPB, MAPK9, MAP2K1, ARL5A, MAP2K5, RRM1, TNK2, VDR, TNNI3K, MAST4, RYR1, RYR2, DYRK1A, TUBA4B, AATK"
GO:0140096,"catalytic activity, acting on a protein",2.77e-06,"FBXO22, USP32, ZNRF2, PRSS3, HGF, CTDSPL, USP13, CLCA2, GGT6, VCPIP1, JAK1, PCSK6, RNF130, GALNT13, ABL1, KALRN, ABL2, BMP1, GALNT8, ADAM2, PAK2, USP20, IRAK4, PSMB2, BAZ1B, CNDP1, BIRC6, ASH1L, FBXO11, KDM2A, JOSD2, PPM1H, ALPK1, ASH2L, CHMP1A, PCSK5, XYLT1, MAEA, C2, PDZRN3, GAK, UHRF2, CAPN5, TRIM45, KDM4B, PHLPP2, RNF220, USP10, SSH1, B4GALNT3, USP34, CPM, PPTC7, PDGFRL, TPST1, PTPN3, SEL1L, PTPN4, PM20D1, AGBL4, PTPN6, RNF166, HECW2, SETD5, HDAC4, ENPEP, PTPRD, PTPRE, AIPL1, MIB1, PTPRG, RNF216, PTPRJ, PTPRM, SEL1L2, PTPRN2, PPM1D, PTPRO, PTPRS, CTDP1, PDIK1L, CPVL, USP35, ZDHHC20, OGFOD1, CAPN13, MAP3K13, MTMR14, ERBB4, UHRF1, CAMK2A, CDK14, GALNTL6, CPQ, TGFBR3, TEX14, GALNT14, NSMCE2, RABGGTA, CASP2, TRIM14, CSNK2B, SIK1, UBE2W, LCK, CDC14B, QPCT, MYLK, ALK, DPP10, MKNK1, CPXM1, ADAMTSL1, TLL1, UBR5, UCHL5, SMYD3, TLK1, PRMT8, HIPK1, CCND3, GALNT15, PTP4A1, SMYD1, ADAMTS5, USP44, MGAT4C, CIT, STK32B, OTUD4, RNF144B, SBK2, PTPRT, PLAT, PHLPP1, REN, PCSK4, RNF11, LTBP1, SGK3, TTLL6, IDE, CTDSPL2, OXSR1, EIF2AK4, CPXM2, ABHD16A, LYN, DTL, HUNK, FER, LONP1, USP3, PP2D1, MAP4K5, MGRN1, CDC25C, CDC42, FGFR2, TNK1, KLK14, VASH2, PAK6, FGR, HDAC7, CDC42BPG, MBTPS1, GRK5, EHMT1, IGF1R, AKAP13, NEDD4L, CTDSP1, NFX1, RNF4, CDK15, RNF6, PIAS4, CAMKMT, BMP2K, RIPK1, TANK, TRIM3, WNK1, MATK, TRIM71, CUL5, KMT2C, RNF152, MED1, NEK11, FLT1, FLT4, HM13, SIK3, ZDHHC17, GSK3A, ADAMTS16, ADAMTS17, JMJD1C, SRC, ROCK2, RHO, PTPRU, NLK, PAPLN, CDKL1, DLG1, UBE3D, HERC4, PRSS57, RNF13, NRP1, MAP3K4, MAP3K5, UBE2D2, UBE2E2, ADAMTS2, EPHA10, GALNT18, HDAC3, NTRK3, ROR2, DDR2, MGAT1, TMEM59, MGAT5, PRKAB1, GALNT7, SENP8, CAMK1D, SEC11A, DPEP1, AGBL1, ATR, PRKCA, DPP6, PPM1E, AURKA, PRKCE, INSR, CHFR, ADCK1, PRKCZ, PRKDC, MAP3K9, CLCA1, MAPK1, MTMR3, MAPK4, STK39, MTMR2, KMT2A, TMPRSS7, BARD1, CDC42BPB, MAPK9, MAP2K1, MAP2K5, TNK2, ADAMTSL3, BAP1, BRAP, TNNI3K, MAST4, USP43, GALNT11, DYRK1A, AATK"
GO:0016301,kinase activity,5.89e-06,"JAK1, LTBP1, SGK3, KALRN, ABL1, ABL2, TPK1, PAK2, OXSR1, EIF2AK4, LYN, IRAK4, HUNK, BAZ1B, FER, MAP4K5, DGKG, PIP5K1A, PIP5K1B, FGFR2, TNK1, ALPK1, PAK6, FGR, CDC42BPG, GRK5, IGF1R, AKAP13, CDK15, BMP2K, RIPK1, GAK, GALK2, WNK1, MATK, PDGFRL, NEK11, FLT1, FLT4, AK3, SIK3, GSK3A, DCAKD, SRC, PPM1D, ROCK2, RHO, NLK, PDIK1L, CDKL1, DGKI, DLG1, DLG2, CARD11, CMPK1, MAP3K13, ERBB4, MAP3K4, NRP1, MAP3K5, CAMK2A, CDK14, EPHA10, TGFBR3, TEX14, NTRK3, ROR2, DDR2, CSNK2B, SIK1, PRKAB1, LCK, CAMK1D, N4BP2, ATR, MYLK, ALK, PRKCA, UCK2, AURKA, PRKCE, MKNK1, INSR, ADCK1, PRKCZ, PRKDC, MAP3K9, MAPK1, MAPK4, STK39, TLK1, NME7, CDC42BPB, HIPK1, MAPK9, CCND3, MAP2K1, MAP2K5, TNK2, CIT, STK32B, TNNI3K, MAST4, SBK2, ADPGK, DYRK1A, AATK"
GO:0005262,calcium channel activity,5.9e-06,"CACNA2D3, CACNA1S, CACNA2D1, TRPM8, CACNG7, CACNG2, CHRNA9, GPM6A, FAM155A, CATSPER3, MCU, PKD1L1, TRPV6, OPRM1, CACNA1H, CUL5, GRIN2C, GRIN2D, PKD1L3, TRPM3, SLC24A4, RYR1, RASA3, RYR2, RYR3, CACNA1A, CACNG5, CACNA1C, CACNA1D"
GO:0019904,protein domain specific binding,7.7e-06,"LRP2, KCNAB1, ABL1, LILRB1, SHANK2, LYN, HIP1R, MPP7, PAWR, WT1, ZNF521, ACOX1, ZFYVE9, DIXDC1, CDC25C, RAPGEF2, CDC42, TCF7L2, EHMT1, CHMP1A, GABRR2, CNOT1, CCR4, SOS1, RIPK1, CRADD, RAPGEF1, AATF, PPP1R9A, GRID2, DOCK4, SP100, FMN1, ARHGEF4, CADM1, PPARA, PPARG, MED1, DFFA, PTPN6, IPCEF1, DAB2IP, HOMER2, KHDRBS1, SH3BP5, EPB41L2, ERC1, SRC, SHISA9, NLRP2, NLK, DLG1, CARD11, EPS15, NFASC, SHANK1, DLC1, ATP2B1, ERCC1, BLNK, MAP3K5, AFAP1, ZBTB16, TGFBR3, RAB6A, RAB6A, SPON1, CASP2, NUMA1, NCOA3, CSNK2B, DNM2, LBR, LDB1, LCK, DOCK1, SKI, PRKAR1A, CAMP, INPP5A, INPP5D, MYO1D, HSP90AA1, INSR, MYO7A, PRKDC, RARA, WASF2, NLGN1, IRS1, RB1, UVRAG, OPRM1, RRM1, BCL2, AFAP1L2, TNK2, AXIN1, CXADR, SLC9A3, CIT, TP63, ICA1, MYPN"
GO:0019900,kinase binding,1.02e-05,"NBEA, NRG1, KIAA1614, KIAA1614, ABL1, PAK2, SOCS5, OXSR1, NEDD9, NEFH, NELL1, WWC1, ACTA2, LRBA, CDC6, PIP5K1A, CDC25C, CDC42, TCF3, TCF7L2, HDAC7, FGR, GRK5, KCNQ1, AKAP13, BCAR3, SASH1, TTC28, DCTN1, RHOH, AATF, SPRED2, SH2B3, PPP1R9A, DOCK4, SDC4, WNK1, SP100, JAKMIP1, KIF11, PTPN6, GATA4, DAB2IP, HDAC4, TBC1D14, GSK3A, KHDRBS1, PTPRJ, SRC, PPM1D, CD226, DLG1, ATP1A4, DLG2, SRCIN1, PHYHIP, MAP3K13, RNF13, NRTN, BLNK, MAP3K5, SHC1, NRG3, IL15RA, TEX14, SHC2, ROR2, KAT2B, ESR1, MOB1B, TRIM14, DNM2, SIK1, PITPNM2, PRKAB1, LCK, SKI, TIAM1, PRKAR1A, CAMP, GAB2, GRB2, ARHGEF7, PRKAR1B, CAMP, FRMD5, AURKA, HSP90AA1, CTBP2, PRKCSH, PRKCZ, MAPK1, RARA, MAPK4, STK39, PPP1R12A, ANGPT4, DSCAM, BARD1, UTRN, CCND3, IRS1, PIK3R1, MAP2K1, WWC2, RB1, RHOBTB1, RHO, TIRAP, AXIN1, ANK2, CIT, CD247, PITPNM3, RYR2, ADIPOR1"
GO:0016773,"phosphotransferase activity, alcohol group as acceptor",1.17e-05,"JAK1, LTBP1, SGK3, KALRN, ABL1, ABL2, PAK2, OXSR1, EIF2AK4, LYN, IRAK4, HUNK, BAZ1B, FER, MAP4K5, DGKG, PIP5K1A, PIP5K1B, FGFR2, TNK1, ALPK1, PAK6, FGR, CDC42BPG, GRK5, IGF1R, AKAP13, CDK15, BMP2K, RIPK1, GAK, GALK2, WNK1, MATK, PDGFRL, NEK11, FLT1, FLT4, SIK3, GSK3A, DCAKD, SRC, PPM1D, ROCK2, RHO, NLK, PDIK1L, CDKL1, DGKI, MAP3K13, ERBB4, MAP3K4, NRP1, MAP3K5, CAMK2A, CDK14, EPHA10, TGFBR3, TEX14, NTRK3, ROR2, DDR2, CSNK2B, SIK1, PRKAB1, LCK, CAMK1D, N4BP2, ATR, MYLK, ALK, PRKCA, AURKA, PRKCE, MKNK1, INSR, ADCK1, PRKCZ, PRKDC, MAP3K9, MAPK1, MAPK4, STK39, TLK1, CDC42BPB, HIPK1, MAPK9, CCND3, MAP2K1, MAP2K5, TNK2, CIT, STK32B, TNNI3K, MAST4, SBK2, ADPGK, DYRK1A, AATK"
GO:0005096,GTPase activator activity,1.23e-05,"PLCB1, TBC1D8, RIN3, RAP1GAP2, ABR, ARAP3, SIPA1L2, DLC1, NRP1, RGS7, TBCD, GIT2, STXBP5L, CHN2, DEPDC5, ADAP1, TBC1D22A, RASA3, RAPGEF2, TBC1D9, DOCK1, DOCK2, RABGAP1, AGAP1, ARHGEF10L, ARHGAP10, SOS1, MYO9A, RAP1GAP, DOCK5, RASA1, DOCK4, TIAM2, STARD13, STAR, ARHGAP32, ACAP1, COIL, RIN2, ARHGAP35, PLEKHG6, SRGAP1, GNAQ, SIPA1L1, SRGAP3, ASAP1, DAB2IP, RGS9, SYDE2, TBC1D14, RASAL2, ARHGEF1"
GO:0060090,molecular adaptor activity,1.29e-05,"KHDRBS1, FBXW7, GAB2, GRB2, MAGI1, PCNT, DLGAP1, AKAP6, AKAP13, DLGAP4, SASH1, AP1G1, TCOF1, CNOT1, CCR4, CRADD, AP2S1, SYNPO2, DLG1, EPS8, NCK2, SH2B3, ITSN2, ITSN1, BLNK, IRS1, PIK3R1, MAP2K1, WWC2, HIP1R, FRMD4A, NEFH, MPP7, SPSB4, SHC1, AFAP1L2, STAP2, EPB41L3, WWC1, TIRAP, BCL3, CUX1, SLC9A1, AXIN1, ANK1, ANK2, SORBS2, DAB2IP, OTUD4"
GO:0035591,signaling adaptor activity,1.51e-05,"KHDRBS1, IRS1, MAP2K1, PIK3R1, GAB2, GRB2, MPP7, SHC1, AKAP13, AFAP1L2, STAP2, AXIN1, DAB2IP, EPS8, SH2B3, NCK2, BLNK"
GO:0019198,transmembrane receptor protein phosphatase activity,1.87e-05,"PTPN6, PTPRM, PTPRN2, PTPRO, PTPRT, PTPRU, PTPRD, PTPRE, PTPRG"
GO:0005001,transmembrane receptor protein tyrosine phosphatase activity,1.87e-05,"PTPN6, PTPRM, PTPRN2, PTPRO, PTPRT, PTPRU, PTPRD, PTPRE, PTPRG"
GO:0016772,"transferase activity, transferring phosphorus-containing groups",1.94e-05,"POLN, REV1, REV1, POLR1A, JAK1, REV3L, LTBP1, SGK3, ABL1, KALRN, TUT1, ABL2, TPK1, PAK2, OXSR1, EIF2AK4, LYN, IRAK4, HUNK, BAZ1B, FER, MAP4K5, DGKG, PIP5K1A, PIP5K1B, TNK1, FGFR2, ALPK1, PAK6, FGR, POLD1, CDC42BPG, GRK5, IGF1R, AKAP13, CDK15, BMP2K, RIPK1, GAK, MED21, GALK2, PIGG, WNK1, MATK, PDGFRL, NEK11, FLT1, FLT4, AK3, SIK3, CTU2, GSK3A, DCAKD, PPM1D, SRC, TEP1, ROCK2, RHO, NLK, PDIK1L, CDKL1, DGKI, DLG1, DLG2, CARD11, CMPK1, MAP3K13, ERBB4, NRP1, MAP3K4, MAP3K5, CAMK2A, CDK14, EPHA10, POLQ, TGFBR3, TEX14, NTRK3, ROR2, DDR2, SIK1, CSNK2B, POLR3E, PRKAB1, LCK, CAMK1D, N4BP2, ATR, MYLK, ALK, PRKCA, UCK2, AURKA, PRKCE, MKNK1, INSR, ADCK1, PRKCZ, PRKDC, MAP3K9, MAPK1, MAPK4, STK39, TLK1, NME7, CDC42BPB, HIPK1, MAPK9, CCND3, MAP2K1, MAP2K5, TNK2, CIT, STK32B, TNNI3K, MAST4, SBK2, ADPGK, DYRK1A, POLR3A, AATK"
GO:0016740,transferase activity,1.95e-05,"FBXO22, ABHD5, NAT1, TADA2A, ZNRF2, GLT8D2, ABAT, PRDM1, ESCO1, GGT6, JAK1, GALNT13, RNF130, ABL1, KALRN, ABL2, GALNT8, PAK2, GBGT1, IRAK4, BAZ1B, BIRC6, ASH1L, PIP5K1A, FBXO11, PIP5K1B, SCP2, ALPK1, ASH2L, XYLT1, MAEA, DTWD2, PDZRN3, GAK, UHRF2, TRIM45, GALK2, GNPAT, TMTC2, RNF220, ALDH1L2, B4GALNT3, PDGFRL, TPST1, SEL1L, RNF166, HECW2, SETD5, HDAC4, CTU2, MIB1, RNF216, SEL1L2, PPM1D, TEP1, NAT10, CHST8, PDIK1L, CERS6, TYW3, ZDHHC20, DGKI, BRD1, MAP3K13, ERBB4, UHRF1, PYGL, CAMK2A, CDK14, PEMT, GALNTL6, TGFBR3, TEX14, GALNT14, NSMCE2, RABGGTA, ST6GAL1, ST3GAL4, TRIM14, CSNK2B, SIK1, UBE2W, ST8SIA1, LCK, QPCT, MYLK, ALK, MKNK1, EXT2, EXTL1, UBR5, NDST1, SMYD3, TLK1, PRMT8, NME7, HIPK1, PRDM2, CCND3, GALNT15, SMYD1, ALG6, ALG6, MGAT4C, CROT, CIT, STK32B, RNF144B, SBK2, POLR3A, POLN, REV1, REV1, POLR1A, LPGAT1, RNF11, REV3L, LTBP1, SGK3, ATG7, TUT1, TPK1, OXSR1, EIF2AK4, METTL4, LYN, HS3ST4, DTL, HUNK, HS3ST2, FER, MAP4K5, MGRN1, DGKG, B3GALT1, CDC42, FGFR2, ST6GALNAC4, TNK1, PAK6, FGR, POLD1, CDC42BPG, GRK5, IGF1R, EHMT1, AKAP13, NMT2, NEDD4L, NFX1, RNF4, CDK15, RNF6, PIAS4, CAMKMT, BMP2K, RIPK1, ST6GALNAC2, MED21, TRIM3, PIGG, GLT1D1, WNK1, MATK, ART3, TRIM71, CUL5, KMT2C, RNF152, NSUN2, MED1, PRDM10, PRDM11, NEK11, FLT1, FLT4, ELOVL2, AK3, CDKAL1, SIK3, ZDHHC17, GSK3A, DCAKD, SRC, GSTA4, ROCK2, RHO, NLK, PRDM12, CDKL1, B3GNT2, DLG1, NAA60, DLG2, CARD11, UST, UBE3D, CMPK1, HERC4, RNF13, NRP1, MAP3K4, MAP3K5, UBE2D2, UBE2E2, MBOAT1, EPHA10, GAL3ST1, POLQ, GALNT18, SPTLC2, NTRK3, ROR2, DDR2, KAT2B, PDSS2, MGAT1, NCOA3, MGAT5, HS6ST3, POLR3E, PRKAB1, GALNT7, CAMK1D, DNMT3B, PTGES, CIITA, N4BP2, ATAT1, ATR, HHAT, PRKCA, UCK2, AURKA, PRKCE, METTL16, INSR, CHFR, ADCK1, PRKCZ, ST8SIA3, PRKDC, MAP3K9, MAPK1, MAPK4, STK39, KMT2A, BARD1, CDC42BPB, MAPK9, KAT6B, MAP2K1, BCAT1, NAA25, MAP2K5, TNK2, NDUFAF5, BRAP, TNNI3K, MAST4, GALNT11, A4GALT, CSGALNACT1, FKRP, ADPGK, DYRK1A, HEXB, AATK"
GO:0016787,hydrolase activity,2.16e-05,"ABHD5, DHX30, USP32, GNA14, PRSS3, HGF, CTDSPL, USP13, LCTL, CLCA2, PADI4, GGT6, VCPIP1, ABCA1, BLM, KIF26B, ATP6V0E1, PCSK6, ABCF1, ABCA4, AFMID, DDX58, BMP1, TAP2, ADAM2, MYO18B, AICDA, USP20, PXDNL, PSMB2, CNDP1, PRUNE2, ACER1, RAB10, RAB10, GAA, NUGGC, JOSD2, DCPS, EDEM1, PPM1H, CHMP1A, RRAGC, PCSK5, C2, CNOT1, CCR4, PLCE1, ADA, KIF9, PDE1A, MYO16, KIFC3, ADARB2, CAPN5, OTOGL, GALNS, RAB38, RAB38, PDE4D, CAMP, PHLPP2, KIF4B, SULF2, USP10, SSH1, ATAD2, USP34, CPM, PPTC7, RAB3C, RAB3C, TTF2, ATAD2B, PTPN3, KIF11, PTPN4, PM20D1, AGBL4, PTPN6, XRN1, SETX, ENPP3, EPHX4, HDAC4, ENPEP, PTPRD, PTPRE, PTPRG, VWA8, PTPRJ, PTPRM, PTPRN2, PPM1D, PTPRO, PTPRS, CTDP1, TUBB4A, CPVL, USP35, CAPN13, MYO3B, DDX4, MTMR14, ATP8A1, ERCC1, ERCC3, MX2, ERCC4, TSEN2, CPQ, RAD54L2, RAB6A, RAB6A, RAB31, RAB31, ABCB1, CGNL1, CASP2, MCM9, LCK, PLA2G2F, MYH11, CDC14B, RAD51C, AGAP1, MACROD2, MYO1D, HSP90AA1, DPP10, MYO5B, MYO7A, CPXM1, EP400, MYO9A, RAP1B, RAP1B, ADAMTSL1, TLL1, RAP1GAP, MYO10, INO80, DHX37, NDST1, GANAB, UCHL5, RASA1, DDX46, PTP4A1, LIPA, ADAMTS5, USP44, AIG1, RHOBTB1, RHO, NUDT7, GNAL, NANP, GNAQ, OTUD4, PTPRT, ABCC11, DNAH17, PLAT, MMAA, PLCB2, APPBP2, PLCB1, ATP2C2, PHLPP1, GNL1, PLCG2, REN, PCSK4, ATP11A, HELZ, RFC2, IDE, CTDSPL2, PNLIPRP3, DNAI1, DDX39B, NUDT4, CPXM2, DIS3L2, ABHD16A, ATP2C1, RGS7, SMPD1, LONP1, USP3, PP2D1, RAB28, RAB28, PMS1, IQCA1, SMG6, ATP13A4, RIT2, DNAH11, CDC25C, SGPP2, CDC42, KLK14, NUDT13, ABCC3, VASH2, HDAC7, POLD1, LIPG, ARG1, MBTPS1, RNASE4, DNAH3, FHIT, MAN2B2, DCTD, CTDSP1, DCTN1, DNAH1, PDE7B, MAN2C1, RHOH, ABCC12, TANK, ARL2, NIT2, DHX9, DHX15, NAV3, MPPE1, ARHGAP35, RAD9B, ALKBH2, RGS9, HM13, SGPP1, PLCZ1, GDPD5, ADAMTS16, ADAMTS17, IL1RAP, PTPRU, PADI3, PAPLN, GNA13, CLPB, ATP1A3, PIGL, ATP1A4, DLG1, MSH6, KIF23, PLCD3, INPP4B, CHD2, PRSS57, ATP2B1, MGLL, ADAMTS2, ACSBG2, DDX50, DNA2, POLQ, HDAC3, ATP8A2, DNAH8, INPP5K, KIF6, MTHFD2L, DNASE1, ABCA13, CHRM3, CHRM5, ATP6V1B1, TMEM59, DNM2, SENP8, SEC11A, N4BP2, DPEP1, AGBL1, RAB3D, RAB3D, ABCA12, INPP5A, DPP6, INPP5D, PPM1E, MACF1, ATP6V1E2, AGO3, LYZL6, CLCA1, MTMR3, MTMR2, TMPRSS7, ENTPD4, ISG20L2, INPP5F, TMEM62, CANT1, PLBD2, ADAMTSL3, BAP1, DIS3, PITPNM3, USP43, ARSG, HEXB, TUBA4B"
GO:0001784,phosphotyrosine residue binding,2.73e-05,"IRS1, FGR, PIK3R1, SHC1, PLCG2, BCAR3, SH2D3C, PTPN3, PTPN6, ABL1, ABL2, MAPK1, NCK2, LCK, RASA1"
GO:0060589,nucleoside-triphosphatase regulator activity,2.79e-05,"PLCB1, TBC1D8, RIN3, RAP1GAP2, ABR, ARAP3, SIPA1L2, DLC1, CDC42SE1, NRP1, SLIT2, RGS7, TBCD, GIT2, STXBP5L, CHN2, DEPDC5, ADAP1, TBC1D22A, RASA3, RAPGEF2, TBC1D9, DOCK1, DOCK2, RABGAP1, RIMS1, AGAP1, RALGDS, ARHGEF10L, ARHGAP10, SOS1, MYO9A, RHOH, RAP1GAP, ARL2, DOCK5, GRPEL1, RASA1, DOCK4, DNAJC1, TIAM2, STARD13, STAR, ARHGAP32, ACAP1, COIL, RIN2, TNK2, ARHGAP35, PLEKHG6, SRGAP1, GNAQ, SIPA1L1, SRGAP3, ASAP1, DAB2IP, RGS9, SYDE2, TBC1D14, RASAL2, ARHGEF1"
GO:0005516,calmodulin binding,3.63e-05,"EPB41, PLCB1, SPTBN1, CACNA1S, PCNT, MYLK, KCNQ1, KCNQ2, PCP4, MYO1D, EWSR1, MYO5B, MKNK1, MYO7A, CNN3, MYO10, CALD1, PDE1A, MAP6, ATP2B1, CAMK2A, TRPV6, ADD3, AKAP12, KCNH1, MBP, SLC8A1, SLC9A1, NDUFAF4, RIT2, RYR1, RYR2, UNC13B, RYR3, SYT1, CAMK1D, PHKB, MYH11, CACNA1C"
GO:0022839,ion gated channel activity,3.84e-05,"CACNA2D3, CACNA1S, CACNA2D1, KCNG3, CACNG7, CLCA2, KCNAB1, CNGB1, CACNG2, HCN1, KCNV1, FAM155A, ANO1, KCNH7, KCNT1, KCND3, KCNK18, KCNH1, KCNJ1, RASA3, CHRNB3, KCNJ16, CACNG5, GABRB2, TRPM8, KCNQ1, KCNQ2, GABRR1, GABRR2, CHRNA9, GLRA3, CLIC5, CLCA1, TMEM63A, CLCN2, CATSPER3, GRID2, CLCNKB, GRIK1, OPRM1, GRIK4, CACNA1H, GRIN2C, GRIN2D, HTR3A, TRPM3, ANO4, RYR1, KCNU1, RYR2, RYR3, KCNK13, CACNA1A, SCN11A, CACNA1C, CACNA1D"
GO:0003682,chromatin binding,4.18e-05,"AUTS2, DHX30, JMJD1C, KLF4, TADA2A, POLR1A, SFMBT2, PRDM1, APBB1, TFAM, SAFB, MSH6, L3MBTL4, SMARCC1, UHRF1, ERCC1, RAD21L1, RAD21, PHC2, ERCC4, DMRT1, IFT74, POLQ, USP3, HDAC3, PELP1, TAF9, IKZF3, KAT2B, RIT2, ESR1, BAHCC1, PPARGC1A, ASH1L, CSNK2B, BCAS3, NFIA, MCM9, STAG1, LDB1, DNMT3B, STAT5B, TOX2, POLD1, TSHZ3, GRHL2, ZNF276, RNF4, GLI2, GLI3, MITF, EP400, CTBP2, SAMD7, ONECUT1, ARID3A, RARA, MLLT10, ZNF274, ARID1B, MLLT3, SP3, OVOL2, DHX9, ATAD2, HNRNPU, TNRC18, NAP1L4, ATAD2B, PPARG, MED1, CBX1, PRDM11, BAP1, PKNOX1, MSL1, BAHD1, TP63, HDAC4, POLR3A, SBNO2"
GO:0044877,protein-containing complex binding,4.23e-05,"GNA14, HGF, USP13, NRG1, CNGB1, SACS, EIF4H, NEBL, SCARB1, PAFAH1B1, ABL1, ABL2, IDE, SALL2, XIRP2, ADAM2, BAG6, BCL2, LILRB1, SMARCC1, DDX39B, CD44, LYN, ARPC1A, HIP1R, CORO1C, NEFH, DST, COL6A2, MAD1L1, FGF1, NEAT1, SMG6, DEPDC5, CLMN, KBTBD13, FHOD3, HMGB1, SORBS1, FGR, IGF1R, STAB2, MSR1, CDH13, CTNNAL1, RNF4, CLASP1, BMP2K, RIPK1, MYO16, GRB10, SYNE1, MLLT10, EPS8L1, EPS8, NCK2, ARID1B, RAB38, RAB38, PPP1R9A, DHX9, AJAP1, HNRNPU, ADD3, PPARA, XPO5, MED1, WIZ, DAB2IP, HOMER2, KHDRBS1, SPTB, SRC, CD226, COTL1, CTDP1, GNA13, RCSD1, EDIL3, EGF, PPP2R2A, MSH6, CORO7, CTNNA3, ARPC3, MAP3K13, SHANK1, UHRF1, ERCC1, GAS7, ABLIM2, TMOD4, ERCC4, SHC1, GUCY1A2, HMBOX1, LAMA3, TGFBR3, HRG, LILRA2, CPEB1, DDR2, CAPZB, ATP6V1B1, RPLP1, NUMA1, DNM2, MCM9, LCK, MYH11, SPTBN5, DOCK2, CIITA, SECISBP2, STAB1, TIMP2, ATR, WHAMM, SHROOM3, DLGAP1, PRKCA, FRMD5, MYO1D, HSP90AA1, MACF1, MYO5B, INSR, DNAAF1, MYO7A, GLI3, RAP1B, RAP1B, CTBP2, MYO10, PRKCZ, SCARF1, KCTD2, CTNNA2, WASF2, CYFIP1, UCHL5, CDC42BPB, USH2A, COLEC12, TSPAN4, UTRN, IRS1, NLGN1, KAT6B, PIK3R1, PHIP, ADAMTS5, NAP1L4, SVIL, CLTA, GNAL, CXADR, WASF3, GNAQ, SYNE2, ITGB5, ITGB7, ICAM1, VLDLR"
GO:0004713,protein tyrosine kinase activity,4.35e-05,"FGR, SRC, IGF1R, ALK, JAK1, INSR, ABL1, ABL2, ERBB4, HIPK1, NRP1, LYN, MAP2K1, MATK, EPHA10, MAP2K5, BAZ1B, FER, PDGFRL, NTRK3, TNK2, ROR2, DDR2, FLT1, FLT4, LCK, DYRK1A, FGFR2, TNK1, AATK"
GO:0045309,protein phosphorylated amino acid binding,4.48e-05,"IRS1, FBXW7, FGR, PIK3R1, SCAF4, SHC1, PLCG2, BCAR3, SH2D3C, PTPN3, PTPN6, ABL1, ABL2, MAPK1, LCK, NCK2, RASA1"
GO:0022836,gated channel activity,4.56e-05,"CACNA2D3, CACNA1S, CACNA2D1, KCNG3, CACNG7, CLCA2, KCNAB1, CNGB1, CACNG2, PIEZO1, HCN1, KCNV1, FAM155A, ANO1, KCNH7, KCNT1, KCND3, KCNK18, KCNH1, KCNJ1, RASA3, CHRNB3, KCNJ16, CACNG5, GABRB2, TRPM8, KCNQ1, KCNQ2, GABRR1, GABRR2, GLRA3, CHRNA9, CLIC5, CLCA1, TMEM63A, CLCN2, CATSPER3, GRID2, CLCNKB, GRIK1, OPRM1, GRIK4, CACNA1H, GRIN2C, GRIN2D, HTR3A, TRPM3, ANO4, RYR1, KCNU1, RYR2, RYR3, KCNK13, CACNA1A, SCN11A, CACNA1C, CACNA1D"
GO:0016462,pyrophosphatase activity,7.13e-05,"APPBP2, DHX30, ATP2C2, GNA14, GNL1, ABCA1, ATP11A, BLM, KIF26B, ATP6V0E1, HELZ, ABCF1, ABCA4, RFC2, DDX58, IDE, TAP2, MYO18B, DNAI1, DDX39B, NUDT4, ATP2C1, RGS7, LONP1, PRUNE2, RAB28, RAB28, PMS1, IQCA1, ATP13A4, RIT2, DNAH11, RAB10, RAB10, NUGGC, CDC42, DCPS, ABCC3, NUDT13, DNAH3, FHIT, RRAGC, DCTN1, DNAH1, RHOH, KIF9, ABCC12, ARL2, KIFC3, MYO16, RAB38, RAB38, KIF4B, DHX9, ATAD2, DHX15, NAV3, TTF2, RAB3C, RAB3C, ATAD2B, ARHGAP35, KIF11, SETX, ENPP3, RGS9, VWA8, GNA13, CLPB, TUBB4A, ATP1A3, ATP1A4, MSH6, KIF23, MYO3B, DDX4, CHD2, ATP8A1, ATP2B1, ERCC3, MX2, DDX50, RAD54L2, DNA2, POLQ, ATP8A2, DNAH8, KIF6, RAB6A, RAB6A, ABCA13, RAB31, RAB31, ABCB1, CGNL1, DNM2, MCM9, MYH11, RAD51C, AGAP1, RAB3D, RAB3D, ABCA12, MYO1D, HSP90AA1, MACF1, MYO5B, ATP6V1E2, MYO7A, MYO9A, EP400, RAP1B, RAP1B, RAP1GAP, MYO10, INO80, DHX37, RASA1, DDX46, ENTPD4, RHOBTB1, RHO, CANT1, GNAL, NUDT7, GNAQ, ABCC11, DNAH17, TUBA4B, MMAA"
GO:0099181,structural constituent of presynapse,7.4e-05,"CTBP2, ERC1, ERC2, PPFIA2, BSN"
GO:0016817,"hydrolase activity, acting on acid anhydrides",7.93e-05,"APPBP2, DHX30, ATP2C2, GNA14, GNL1, ABCA1, ATP11A, BLM, KIF26B, ATP6V0E1, HELZ, ABCF1, ABCA4, RFC2, DDX58, IDE, TAP2, MYO18B, DNAI1, DDX39B, NUDT4, ATP2C1, RGS7, LONP1, PRUNE2, RAB28, RAB28, PMS1, IQCA1, ATP13A4, RIT2, DNAH11, RAB10, RAB10, NUGGC, CDC42, DCPS, ABCC3, NUDT13, DNAH3, FHIT, RRAGC, DCTN1, DNAH1, RHOH, KIF9, ABCC12, ARL2, KIFC3, MYO16, RAB38, RAB38, KIF4B, DHX9, ATAD2, DHX15, NAV3, TTF2, RAB3C, RAB3C, ATAD2B, ARHGAP35, KIF11, SETX, ENPP3, RGS9, VWA8, GNA13, CLPB, TUBB4A, ATP1A3, ATP1A4, MSH6, KIF23, MYO3B, DDX4, CHD2, ATP8A1, ATP2B1, ERCC3, MX2, DDX50, RAD54L2, DNA2, POLQ, ATP8A2, DNAH8, KIF6, RAB6A, RAB6A, ABCA13, RAB31, RAB31, ABCB1, CGNL1, DNM2, MCM9, MYH11, RAD51C, AGAP1, RAB3D, RAB3D, ABCA12, MYO1D, HSP90AA1, MACF1, MYO5B, ATP6V1E2, MYO7A, MYO9A, EP400, RAP1B, RAP1B, RAP1GAP, MYO10, INO80, DHX37, RASA1, DDX46, ENTPD4, RHOBTB1, RHO, CANT1, GNAL, NUDT7, GNAQ, ABCC11, DNAH17, TUBA4B, MMAA"
GO:0016818,"hydrolase activity, acting on acid anhydrides, in phosphorus-containing anhydrides",7.93e-05,"APPBP2, DHX30, ATP2C2, GNA14, GNL1, ABCA1, ATP11A, BLM, KIF26B, ATP6V0E1, HELZ, ABCF1, ABCA4, RFC2, DDX58, IDE, TAP2, MYO18B, DNAI1, DDX39B, NUDT4, ATP2C1, RGS7, LONP1, PRUNE2, RAB28, RAB28, PMS1, IQCA1, ATP13A4, RIT2, DNAH11, RAB10, RAB10, NUGGC, CDC42, DCPS, ABCC3, NUDT13, DNAH3, FHIT, RRAGC, DCTN1, DNAH1, RHOH, KIF9, ABCC12, ARL2, KIFC3, MYO16, RAB38, RAB38, KIF4B, DHX9, ATAD2, DHX15, NAV3, TTF2, RAB3C, RAB3C, ATAD2B, ARHGAP35, KIF11, SETX, ENPP3, RGS9, VWA8, GNA13, CLPB, TUBB4A, ATP1A3, ATP1A4, MSH6, KIF23, MYO3B, DDX4, CHD2, ATP8A1, ATP2B1, ERCC3, MX2, DDX50, RAD54L2, DNA2, POLQ, ATP8A2, DNAH8, KIF6, RAB6A, RAB6A, ABCA13, RAB31, RAB31, ABCB1, CGNL1, DNM2, MCM9, MYH11, RAD51C, AGAP1, RAB3D, RAB3D, ABCA12, MYO1D, HSP90AA1, MACF1, MYO5B, ATP6V1E2, MYO7A, MYO9A, EP400, RAP1B, RAP1B, RAP1GAP, MYO10, INO80, DHX37, RASA1, DDX46, ENTPD4, RHOBTB1, RHO, CANT1, GNAL, NUDT7, GNAQ, ABCC11, DNAH17, TUBA4B, MMAA"
GO:0005216,ion channel activity,8.72e-05,"CACNA2D3, CACNA1S, CACNA2D1, KCNG3, CACNG7, CLCA2, KCNAB1, CNGB1, CACNG2, PIEZO1, HCN1, KCNV1, GPM6A, FAM155A, ANO1, PKD1L1, KCNH7, TRPV6, KCNT1, KCND3, KCNK18, KCNH1, KCNJ1, SLC24A4, RASA3, CHRNB3, KCNJ16, CACNG5, GABRB2, TRPM8, KCNQ1, KCNQ2, GABRR1, GABRR2, GLRA3, CHRNA9, LRRC8A, CLIC5, CLCA1, TMEM63A, CLCN2, CATSPER3, GRID2, MCU, CLCNKB, GRIK1, OPRM1, GRIK4, CACNA1H, CUL5, GRIN2C, GRIN2D, HTR3A, PKD1L3, TRPM3, UNC80, ANO4, RYR1, RYR2, RYR3, KCNK13, CACNA1A, SCN11A, CACNA1C, CACNA1D"
GO:0019901,protein kinase binding,8.8e-05,"NBEA, NRG1, KIAA1614, KIAA1614, ABL1, PAK2, SOCS5, OXSR1, NEDD9, NEFH, NELL1, ACTA2, LRBA, CDC25C, CDC42, TCF3, TCF7L2, HDAC7, FGR, GRK5, KCNQ1, SASH1, DCTN1, RHOH, AATF, SPRED2, SH2B3, PPP1R9A, DOCK4, SDC4, WNK1, KIF11, PTPN6, GATA4, DAB2IP, HDAC4, TBC1D14, GSK3A, KHDRBS1, PTPRJ, SRC, PPM1D, CD226, DLG1, SRCIN1, PHYHIP, MAP3K13, RNF13, NRTN, BLNK, MAP3K5, SHC1, NRG3, IL15RA, TEX14, SHC2, ROR2, KAT2B, ESR1, TRIM14, DNM2, SIK1, PITPNM2, PRKAB1, LCK, SKI, TIAM1, PRKAR1A, CAMP, GAB2, GRB2, ARHGEF7, PRKAR1B, CAMP, FRMD5, AURKA, HSP90AA1, CTBP2, PRKCSH, PRKCZ, MAPK1, RARA, MAPK4, STK39, PPP1R12A, ANGPT4, DSCAM, UTRN, CCND3, IRS1, PIK3R1, RHOBTB1, RHO, TIRAP, AXIN1, ANK2, CIT, CD247, PITPNM3, RYR2, ADIPOR1"
GO:0046873,metal ion transmembrane transporter activity,9.93e-05,"CACNA2D3, ATP2C2, CACNA1S, CACNA2D1, KCNG3, CACNG7, KCNAB1, SLC20A2, CACNG2, SLC28A1, SLC13A3, ATP1A3, ATP1A4, HCN1, SLC34A3, KCNV1, GPM6A, FAM155A, ATP2B1, PKD1L1, ATP2C1, KCNH7, TRPV6, KCNT1, SLC30A8, KCND3, SLC9B2, KCNK18, KCNH1, KCNJ1, TMEM165, SLC24A4, RASA3, SLC41A1, KCNJ16, CACNG5, TRPM8, KCNQ1, SLC1A1, KCNQ2, SLC1A2, TUSC3, SLC1A6, CHRNA9, CATSPER3, MCU, GRIK1, OPRM1, GRIK4, CACNA1H, CUL5, GRIN2C, GRIN2D, PKD1L3, SLC8A1, SLC9A1, TRPM3, SLC9A3, RYR1, RYR2, RYR3, KCNK13, ZDHHC17, SLC39A11, CACNA1A, SCN11A, CACNA1C, CACNA1D"
GO:0008270,zinc ion binding,0.000108,"KLF4, USP13, POLR1A, ESCO1, RNF11, BLM, DDX58, BMP1, IDE, ZNF385D, L3MBTL4, CPXM2, AICDA, PHC2, USP20, SMPD1, BAZ1B, NR2C2, CXXC5, SLC30A8, USP3, ZFHX2, NR1H4, FBXO11, KDM2A, SCAPER, EHMT1, CHMP1A, SOD1, CA10, DCTD, NFX1, RNF4, PIAS4, TET3, ADA, PDZRN3, DBF4, TRIM45, TRIM3, ZNF2, ZCCHC2, CPM, TRIM71, NQO2, PPARA, TTF2, PPARG, ZSWIM8, AGBL4, ZNF407, GATA4, CA5A, ZNF385C, ENPP3, HDAC4, ENPEP, TRIM67, MIB1, ZFHX3, DPF3, NR6A1, ZNF90, ZDHHC20, UHRF1, ADAMTS2, HRG, WDFY1, NSMCE2, ZMYM4, ZMYM6, ESR1, RABGGTA, TRIM14, SEC24B, ZMYM2, SKI, DPEP1, AGBL1, TIMP2, QPCT, PRKCA, ZNF276, GLI2, CPXM1, GLO1, TLL1, UBR5, RABGEF1, RARA, NR1D1, KMT2A, MORC3, PRDM2, UTRN, ADAMTS5, USP44, DTNA, DTNB, KLF7, SEC24A, ZNF93, VDR, BRAP, VAT1L, VAT1, PRICKLE2"
GO:0015075,ion transmembrane transporter activity,0.000128,"CACNA2D3, ATP2C2, SLC29A4, SLC43A2, KCNAB1, SLC20A2, CLCA2, CNGB1, ATP6V0E1, SLC13A3, SLC34A3, KCNV1, GPM6A, FAM155A, SLC22A16, ANO1, PKD1L1, ATP2C1, TRPV6, SLC30A8, KCND3, KCNK18, KCNH1, KCNJ1, TMEM165, SLC37A4, SLC17A8, SFXN5, KCNJ16, CACNG5, ABCC3, GABRB2, KCNQ1, KCNQ2, GABRR1, TUSC3, GABRR2, GLRA3, CHRNA9, SLC2A14, SLC25A18, TMEM63A, CATSPER3, GRID2, GRIK1, GRIK4, CUL5, GRIN2C, GRIN2D, PKD1L3, SLC38A9, ANO4, ZDHHC17, CACNA1A, SCN11A, SLC39A11, CACNA1C, SLC25A21, CACNA1D, CACNA1S, CACNA2D1, KCNG3, CACNG7, CACNG2, PIEZO1, SLC38A6, SLC28A1, ATP1A3, ATP1A4, SLC27A2, HCN1, ATP8A1, ATP2B1, KCNH7, SLC35A3, KCNT1, SLC44A1, SLC9B2, ABCB1, ATP6V1B1, SLC24A4, RASA3, CHRNB3, SLC41A1, SLC35D2, TRPM8, SLC1A1, OCA2, SLC1A2, SLC4A3, SLC10A7, SLC1A5, SLC1A6, ATP6V1E2, LRRC8A, CLIC5, CLCA1, CLCN2, TMEM30A, MCU, CLCNKB, OPRM1, CACNA1H, SLC41A2, HTR3A, SLC7A2, SLC8A1, SLC9A1, TRPM3, SLC9A3, UNC80, RYR1, KCNU1, RYR2, RYR3, ABCC11, KCNK13"
GO:0005261,cation channel activity,0.000157,"CACNA2D3, CACNA1S, CACNA2D1, KCNG3, CACNG7, KCNAB1, CNGB1, CACNG2, PIEZO1, HCN1, KCNV1, GPM6A, FAM155A, ANO1, PKD1L1, KCNH7, TRPV6, KCNT1, KCND3, KCNK18, KCNH1, KCNJ1, SLC24A4, RASA3, CHRNB3, KCNJ16, CACNG5, TRPM8, KCNQ1, KCNQ2, CHRNA9, TMEM63A, CATSPER3, MCU, GRIK1, OPRM1, GRIK4, CACNA1H, CUL5, GRIN2C, GRIN2D, HTR3A, PKD1L3, TRPM3, UNC80, RYR1, RYR2, RYR3, KCNK13, CACNA1A, SCN11A, CACNA1C, CACNA1D"
GO:0051015,actin filament binding,0.000162,"SPTB, SHROOM3, COTL1, MYO1D, CTNNAL1, MACF1, MYO5B, MYO7A, RCSD1, NEBL, MYO10, ABL1, CORO7, ABL2, MYO16, CTNNA3, XIRP2, SYNE1, CTNNA2, CYFIP1, ARPC3, PPP1R9A, UTRN, GAS7, HIP1R, ARPC1A, ABLIM2, CORO1C, TMOD4, ADD3, SVIL, CAPZB, CLMN, SYNE2, KBTBD13, FHOD3, MYH11, SPTBN5"
