GO Term,Description,P-value,Genes
GO:0005515,protein binding,3.55e-11,"FBXO22, USP32, CTDSPL, ABAT, SACS, ABCA1, PCSK6, EIF4H, ABCF1, PAFAH1B1, ABL1, ABL2, ABR, ADAM2, SERPINE1, ACACB, PAK2, MYO18B, PALM, PAWR, WT1, NPAS3, ACOX1, PBX1, ACTA2, SLC37A4, STAG1, NPFFR1, INTS6, PCNT, CHMP1A, RRAGC, PCP4, GABRR2, AGO1, PCSK5, MAEA, GDAP1, ADA, GAK, KIF9, PDE1A, ADCY2, ZNF2, AATF, TMEM9, PDE4D, CAMP, SSH1, DNAJC1, ADD3, LRCH3, RIN2, ZNF23, ATAD2B, TMEM25, MS4A6A, AGBL4, GATA4, CCSER2, XRN1, ARHGEF28, EPHX4, CTU2, RNF216, PLEKHA5, NR6A1, CHST8, CACNG2, GREM2, AP1G1, RBM47, CERS6, TUBB4A, CDH22, MYO3B, HCN1, ARAP3, PUS7, ZNF566, APBB1IP, MTMR14, DLC1, CHODL, AGTR1, GFRA3, ATP8A1, MYL9, CDK14, ZBTB16, EXOC6, CPQ, CPEB1, LTV1, SPON1, NECAB2, ABCB1, CGNL1, MCM9, SEC24B, BRI3BP, PROSER2, PHKB, SLC41A1, ZMYM2, OLFM1, N4BP2L2, ALK, FRMD5, NAALADL2, GLI2, GLI3, GLO1, RBM17, INO80, RILPL1, PIBF1, SMYD3, TNS3, PIK3R1, PTP4A1, AMPH, GMDS, S100PBP, PCED1A, PC, ANK1, GNAL, ANK2, RBFOX1, GNAQ, PKNOX1, VAT1, CRTC3, RASGEF1C, OTUD4, GINS3, RNF144B, UNC13B, SEMA6C, ZBTB8B, PLAT, SEMA4D, GNG7, PLCB2, APPBP2, MYBBP1A, NBEA, POLN, IL25, AOC2, PLCG2, FAM20A, KCNAB1, PCSK4, FBXL17, APBA2, APBB1, GOLGA4, RNF11, APBB2, GOLGB1, NEBL, FETUB, SGK3, SLC13A3, ATG7, TUT1, TPK1, SLC34A3, DNAJB12, APLP2, PRRC2A, GPI, BAG6, BCL2, DNAI1, GPM6A, DDX39B, BNC2, APOB, ABHD16A, ARPC1A, MPP7, AHI1, VTI1A, TCERG1L, PELP1, PMS1, ZFHX2, STAU2, NDE1, DIXDC1, BCAS3, MRPS6, FHDC1, TACC2, SORBS1, FRMD3, CATSPERD, POLD1, ARG1, CLUL1, GRK5, PLEKHA7, CDK15, RHOH, ARL2, GRB10, TRIM3, RAPGEF1, MLLT10, POR, ANKRD13A, ZNF664, CPNE7, EPS8L1, EPS8, QRICH1, GRID2, WNK1, DENND2A, TAF6L, TAF6, KRT80, CUL5, CWC25, GRIN2C, A2ML1, GRIN2D, PPARA, NAV3, MPPE1, PPARG, MED1, LEFTY1, RAD9B, GRM6, IGF2BP3, ELOVL2, IGF2BP2, CUEDC1, CDKAL1, ZSCAN18, PPL, GSK3A, KHDRBS1, FOCAD, DDRGK1, ZFHX3, DPF3, ATF3, GSTA4, CD226, TMEM108, FARS2, SLC38A6, GNA13, ATP1A3, PPP2R2A, B3GNT2, ATP1A4, MSH6, COLEC11, NPHP4, BBS9, UBE3D, PPP2R5B, TTC7B, PPP2R5C, AHDC1, CCT6B, LRFN4, ATP2B1, ERLEC1, SLC14A2, LSM1, NDUFS7, NRG3, TXNL4B, GUCY1A2, POLQ, AHNAK, NRG4, ATP6V1B1, BANP, PDLIM3, NCOA3, ZNF544, PRKAB1, ZNF710, EXOC3L2, SECISBP2, PRKAR1A, CAMP, ATR, PRKAR1B, CAMP, TRPM8, PRKCA, TNRC6A, PRKCE, GSG1L, GSG1, IL34, ATP6V1E2, PAK1IP1, B2M, PRKCSH, UTP20, UTP20, PRKCZ, PRKDC, RABGEF1, MAPK1, MAPK4, STK39, YIF1B, ZNF274, BARD1, MAPK9, MCU, PID1, MAP2K1, PHIP, BCAT1, EML4, MAP2K5, BCL2, STARD13, STAR, TRRAP, PICALM, SEC24A, RBM44, BCL3, SDCCAG8, NDUFAF5, LHFPL4, AXIN1, BAP1, BRAP, WASF3, BCL9, NRROS, CCDC28B, IFNL1, FKRP, CDH20, HDLBP, BDKRB1, HEXB, WIPF2, FAXDC2, BFSP1, HGF, PRSS3, NRG1, PRDM1, BLM, KIF26B, ZNF251, SOBP, PSD, BMP1, ZNF534, ZNF578, BMP6, L3MBTL4, LILRB1, ANO1, IGFN1, USP20, PLEKHJ1, PSMB2, DST, MAD1L1, TAF9, NEAT1, RAB10, RAB10, PPARGC1A, PIP5K1A, PIP5K1B, BTF3L4, HMGB1, PSMD8, COL23A1, BCAR3, C2, C3, ZNF569, DBF4, NLRP12, SPIN1, OTOGL, NCK2, WDR25, RNF220, HNRNPU, CABLES1, NXPE3, LDLRAD4, TTF2, TPST1, CBX1, WDR20, PTPN3, PTPN4, SUPT3H, PLEKHG6, PTPN6, SORBS2, SDHAF1, GLIS1, PTPRD, MYOZ3, CACNA1A, PTPRE, CACNA1C, PTPRG, CACNA1D, PTPRJ, CNIH3, CACNA1S, PTPRM, PPM1D, PTPRO, PTPRS, CCNI, NAT10, MTDH, PPFIA2, EXOC8, PDIK1L, RCSD1, ENC1, HPCAL1, OGFOD1, CALD1, CORO7, SLC27A2, LILRB4, CAMK2A, PYGL, GAS7, QDPR, SPSB4, CCNJL, CHMP4C, HMBOX1, HRG, RAB6A, RAB6A, VPS53, RAB31, RAB31, CAPZB, ADAP1, RABGGTA, CASP2, MOB1B, PRTG, SIK1, HSD17B4, UBE2W, LGR5, ARMC7, HSF4, CASQ1, CDC14B, RAD51C, FBXW7, DNER, PRPF18, MCPH1, RUNX1, HORMAD2, RALGDS, RPAP3, ZNF276, HSP90AA1, ARHGAP10, MKNK1, RAP1B, RAP1B, RAP1GAP, SCARF1, HSPG2, RARA, NDST1, RNLS, RASA1, VTCN1, CCND3, SMYD1, RB1, ADAMTS5, COMMD1, HTR3A, PROM2, CIT, CD247, TP63, PTPRT, PUS10, ICA1, ICAM1, RCN2, DNAH17, FADS6, ANKRD55, IRF8, WDR59, TBC1D8, MCM10, REN, NUMB, REV3L, SCARB1, RFC2, TTLL6, IDE, EIF3D, DNAJA4, RFX3, CD44, EIF3J, NUDT4, FOXP2, PSIP1, TRPV6, RGS7, BAZ1A, MAP4K5, KLHL36, LRRC4B, LRBA, RIT2, CLMN, DNAH11, CDC6, CDCA7L, CDC25C, SFXN5, CDC42, TNK1, KCTD1, VASH2, CDC42BPG, ZNF821, CDH8, DNAH3, IGF1R, EHMT1, AKAP13, STAB2, TLE6, CDH13, CTNNAL1, MOB3B, SSC5D, CDH15, RNF4, SPICE1, GBF1, CMTM8, CKLF, RNF6, CHRNA9, CAMKMT, FGD5, RIPK1, CRADD, PLIN5, CNTN4, SH3D19, CCDC102B, PPP1R9A, STAP2, JAKMIP1, TTC27, NEK11, WDR62, SIGLEC5, ROBO2, RBFA, DAB2IP, SLC38A9, TNFRSF11A, BTBD2, MRAP2, ODF3L2, VPS45, IL1RAP, SHISA9, NLRP2, IL2RA, RIN3, HOGA1, ECD, RPL7, FAM81B, NAA60, RCBTB2, INPP4B, MTFR2, CHD2, AHNAK2, NRP1, RNF13, MREG, MGLL, SAMD3, FRMD4A, CASC3, EPHA10, DOK3, LARP4, KIAA0319L, KIAA0319, IL15RA, HDAC3, CHN2, PROM1, TNFRSF9, IKZF3, ZNF326, RPL38, CHRM3, KAT2B, CHRM5, RPLP1, TENM3, LDB1, N4BP2, WDR76, ARHGEF7, INPP5A, HHAT, ZFP64, INPP5D, DLGAP4, GRHL2, SGPL1, PPM1E, INSR, CHFR, AP2S1, NTNG1, EIF2B5, PEBP4, MTMR3, MTMR2, TMEM30A, DOCK5, IRF2, RDH10, IRS1, NLGN1, TTC17, WWC2, EXOC1, PLEKHA6, NAA25, CACNA1H, UBTD1, INPP5F, RRM1, TBC1D23, ZHX2, ERICH1, CLSTN1, TIRAP, CLTA, TMEM74, BAHD1, SKAP2, DIS3, CLVS1, RYR1, CEP164, ITGB5, RYR2, FUBP3, RYR3, TOP3B, ITGB7, RUFY3, SBNO2, DHX30, TUBGCP5, USP13, TRERF1, CNGB1, ADCY10, JAK1, ATP6V0E1, LIMD1, CNN3, HABP4, SAFB, KALRN, SORCS1, CNR2, SALL2, CNTN1, TAF1C, FREM1, SHANK2, SLAMF6, COL4A2, OSBPL6, ATXN1, HIP1R, BAZ1B, COL6A2, IFT74, KCND3, COL9A1, KCNH1, COL9A2, FBXO32, TMEM123, FBXO11, MAP7, FHOD3, KDM2A, SPG11, SCP2, DCPS, LIMCH1, ALPK1, RIMS1, ASH2L, MAPKBP1, KCNQ1, MRPS18B, KCNQ2, CLDN6, CNOT1, CCR4, KIAA0825, KIAA0825, PALLD, TVP23A, TMCC1, UHRF2, KIFC3, MYO16, GRPEL1, TMTC2, PHLPP2, SCUBE1, EGF, KIF4B, SLC43A3, USP10, SDC4, ATAD2, AJAP1, NSFL1C, ALDH1L2, MON2, DENND5B, SDHB, PPTC7, FNBP1, KLHL7, CCDC60, RAB3C, RAB3C, SEC14L1, KIF11, SEL1L, RNF166, NDUFAF4, KPNA1, CCDC59, SETX, CREB1, KPNA3, SWAP70, TIMM21, ARHGEF1, CBFA2T2, VWA8, PPRC1, PHACTR3, ERC1, CRMP1, EXPH5, PCDHGA4, ZNF423, SRSF3, CTDP1, PDCD1LG2, SFTPC, MCF2L2, TSGA10, SGCA, DGKI, FSTL4, SGCG, RAP1GAP2, CTNNA3, SRCIN1, NFASC, MAP3K13, ITSN1, UHRF1, BLNK, TMOD4, LAIR1, TSEN2, SHC1, RAD54L2, LAMA3, EPB41L3, TEX14, NSMCE2, PARVB, ZMYM4, LAMC2, ST6GAL1, LRRFIP1, CSNK2B, ST8SIA1, LBR, LCK, SIM1, CMIP, TBC1D9, SKI, UBN1, MAGI1, STAB1, AGAP1, APOL6, DLGAP1, SLC1A1, TTLL12, SLC1A2, SLC4A3, SLC1A5, KANK4, LRRC8A, CTBP2, NPL, KANK1, CTNNA2, CYFIP1, HCFC2, WNT5B, GANAB, PYCR2, CTNND2, NME7, PRMT8, GALNT15, DNAJC12, PARD3B, LMNA, SLC8A1, CUX1, SLC9A1, CXADR, SLC9A3, OSGIN1, SYNE2, VPS13A, LPP, SOCS6, MMAA, PLCB1, MUC13, LRP2, PHLPP1, KLF4, NREP, SCHIP1, PDS5A, LSS, ATP11A, LTBP1, GTF3C3, KAZN, SLIT3, BAZ2B, ILDR1, SMARCC1, LIN9, CD180, FSTL5, LYN, PKD1L1, SLIT2, KLHL18, HUNK, SMPD1, FAM149B1, CAPRIN1, MTUS2, SLC30A8, LONP1, WWC1, DAB1, RAB28, RAB28, ANKS1B, SMG6, NRXN3, MGRN1, SH3GLB2, ZFYVE9, STARD7, STAR, IFT46, KBTBD13, MAFG, NRXN1, CDR2L, NXPE2, OIT3, SCAPER, PAK6, DCC, MAN2B2, DUS3L, SOD1, NMT2, DCTD, NEDD4L, SASH1, TTC28, ARNTL2, DCTN1, MAL, MAL, GRAP2, GRB2, CLASP1, SOS1, SOS2, SOX5, MED21, SYNE1, DOCK9, MAP4, MAP6, TMEM132D, ITSN2, SP3, NTN1, IGFL4, DHX9, SP100, DHX15, MATK, ARHGEF4, PRDM10, MBP, PRDM11, DFFA, FGD4, ASAP1, SYNC, BTBD11, MCC, AK3, ANO4, HM13, ALKBH2, HOMER2, SIK3, ZDHHC17, TEX29, RASAL2, GDPD5, SPTB, SPTBN1, SH3BP5, SRC, AKAP6, KCNG3, COTL1, NQO1, ROCK2, RHO, SREBF2, CABP1, RARS2, CLPB, CRB1, DLG1, SYNPO2, DLG2, KIF23, GRIP1, MEIS2, SHANK1, MAP3K4, MAP3K5, FRMD6, DMRT1, SLC35A3, DNA2, STXBP5L, DNAH8, AVEN, DIAPH3, DNASE1, SHCBP1L, MGAT1, PDSS2, VMP1, TMEM59, STAC, DNM2, ASCC1, DNMT3B, STAT4, CAMK1D, SENP8, PTGES, DOCK1, STAT5B, DOCK2, CIITA, SEC11A, NRG2, DPEP1, RAB3D, RAB3D, AGBL1, WHAMM, FSD2, DPYD, AURKA, NETO2, MACF1, RGL3, DAAM2, SBF2, MITF, ARHGEF33, MKLN1, ZBTB7B, ST8SIA3, AGO3, KCTD2, SPATA33, MAP3K9, GABBR2, ARID3A, NR1D1, SPIDR, KMT2A, MORC3, MLLT3, DSCAM, GPR139, KAT6B, ISG20L2, CREB5, DTNA, DTNB, AKAP12, MSI2, SVIL, SEH1L, CANT1, PLBD2, ADAMTSL3, RBFOX2, TNNI3K, PITPNM3, SYT1, PSD4, ADIPOR1, DYRK1A, AATK, TACC1, ABHD5, TACR1, ERGIC1, E2F3, TADA2A, GNA14, CLDN14, SLC43A2, TAF4B, PADI4, ARHGEF10, GGT6, ZNF592, ACSF3, TAF12, MICAL2, PLVAP, AFMID, DDX58, TAP2, SOCS5, ASB3, ZNF516, OPN3, CEP135, AICDA, PHC2, IRAK4, TBCA, CORO1C, SAFB2, TBCD, INSIG2, RAVER1, ACER1, EFNA1, EFNA2, EFNA5, CC2D1B, BIRC6, NUP93, MEGF8, HNF1A, RAPGEF2, KPNA6, JOSD2, TCF3, EDEM1, TCF7L2, RABGAP1, PPM1H, TEKT1, GCFC2, GC, SCAF4, MSR1, SSBP3, TRAPPC9, CALN1, EIF4EBP1, TCOF1, RAPGEFL1, TET3, PLCE1, ZBTB8A, STX12, SLC25A18, TMEM63A, WTIP, ARID1B, SPRED2, RAB38, RAB38, DOCK4, USP34, GLTP, CADM1, GABPB2, ARHGAP32, MTUS1, ACAP1, COIL, XPO5, ROPN1L, HECW2, SRGAP1, ZNF385C, MSL1, TAF3, RSPH3, HDAC4, TDGF1, AIPL1, TBC1D14, MIB1, SLC44A3, TEAD4, HMCN1, EPB41, EPB41L2, TEP1, OSBP2, PIEZO1, TFAM, GOLM1, TYW3, TIGIT, MTSS1, BRD1, MUC2, SMIM14, EPS8, EPS15, PHYHIP, BCL2L13, BCL2, TCEANC2, STARD3NL, ERBB4, DOCK6, ERCC1, ERCC3, MX2, ERCC4, CTIF, SFI1, MYBPC2, GIT2, TGFBR3, SHC2, WDFY1, EBF4, TBC1D22A, ESR1, FAM172A, TSNARE1, TRIM14, GOLT1A, THPO, PITPNM2, EMILIN2, DIP2B, MYH11, ZEB2, SPTBN5, ETV1, TIAM1, TIMP2, GAB2, GRB2, TSHZ3, MYLK, QPCT, SHROOM3, MYO1D, EWSR1, FARP2, MYO5B, KIAA0319, KIAA0319, DPP10, EXT2, TLE1, CEP350, AGMO, MYO7A, HOOK1, EXTL1, MYO9A, EP400, MYO10, MAGI2, ATXN10, UBR5, DHX37, PPP1R12A, FCHSD2, UCHL5, TLK1, ANGPT4, HIPK1, TSPAN4, GPR137B, TSHZ2, AIG1, USP44, SLC41A2, RHOBTB1, RHO, NAP1L4, ABTB2, PCGF6, QRFPR, NCAM2, TNF, SV2B, ZNF345, TECPR1, VAT1L, SRGAP3, ARMC8, LRRC4C, ANAPC7, TNNT1, ATP2C2, TNR, FBLN2, NDUFAB1, REV1, REV1, NLRC5, POLR1A, KIAA1614, KIAA1614, POC1A, SFMBT2, NDUFB7, PLEKHG4, HELZ, TPD52, MTHFD1L, XIRP2, CTDSPL2, SCUBE2, EGF, OXSR1, DIS3L2, NEDD9, DTL, NEFH, NELL1, ZNF521, NR2C2, CXXC5, FER, USP3, VWA2, FGF1, WWTR1, THRAP3, NR1H4, VPS54, NFIA, FYTTD1, FGF14, NFE2L1, GPC5, FGFR2, FLYWCH1, NFIX, FGR, HDAC7, FHIT, NFKBIL1, CASP8AP2, NFX1, CTDSP1, DNAH1, PIAS4, TANK, NINJ2, GET4, SH2B3, OVOL2, DOK6, TENM4, ZNF462, FMN1, TRIM71, NQO2, KMT2C, RNF152, ATXN1L, PKD1L3, SH2D3C, EPS15L1, FLOT2, TTC1, FLT1, IPCEF1, WIZ, FLT4, SIPA1L1, SETBP1, FAM13C, CNTNAP2, NUB1, NPAS1, SARNP, PPP1R16B, AUTS2, JMJD1C, ERC2, FAM171A1, HACL1, CACNG7, ZSCAN22, PTPRU, NLK, SIGIRR, PADI3, ATP9A, PRDM12, SPATA13, TYROBP, EDIL3, EGF, CPNE2, UIMC1, CARD11, ARPC3, NRF1, RAB11FIP4, TSPAN5, NRTN, LGR6, WWOX, UBE2D2, AFAP1, ABLIM2, UBE2E2, LRRC73, LCOR, SLC9B2, ATP8A2, NTRK3, UBE2V2, INPP5K, KIF6, ROR1, ROR2, DDR2, RSF1, BACH2, RSPO4, NUMA1, UPK1B, CNFN, FASTKD5, CCDC81, PHACTR1, UGDH, ABCA12, OCA2, UCK2, LRP1B, JAZF1, PLXNC1, SDK1, STARD4, STAR, FOXK1, SAMD7, CLIC5, FARP1, THSD7A, WASF2, PITPNC1, OPCML, SLC22A23, USH2A, UTRN, FXYD6, KIRREL3, OPRM1, UVRAG, EML6, RBM6, ATXN7L1, AFAP1L2, PACRG, TNK2, SH2D4A, VDR, VEGFB, VEGFC, GALNT11, CCDC62, VLDLR, MYPN, TMEM130"
GO:0003779,actin binding,5.15e-11,"SPTB, WIPF2, EPB41, SPTBN1, PHACTR3, EPB41L2, COTL1, NEBL, RCSD1, CNN3, MICAL2, ENC1, MTSS1, ABL1, SYNPO2, CORO7, CALD1, ABL2, CTNNA3, XIRP2, MYO3B, EPS8, ARPC3, MYO18B, GAS7, AFAP1, HIP1R, ARPC1A, ABLIM2, TMOD4, CORO1C, PAWR, WT1, DST, MYBPC2, EPB41L3, DIAPH3, DNASE1, PARVB, CAPZB, CLMN, PDLIM3, DIXDC1, KBTBD13, FHOD3, FHDC1, SORBS1, MYH11, SPTBN5, PHACTR1, VASH2, LIMCH1, WHAMM, SHROOM3, MYLK, MYO1D, PRKCE, CTNNAL1, MACF1, DAAM2, MYO5B, MAEA, MYO7A, HOOK1, MYO9A, PALLD, MYO10, INO80, MYO16, SYNE1, CTNNA2, WASF2, CYFIP1, EPS8L1, EPS8, PPP1R9A, UTRN, SSH1, HNRNPU, FMN1, ADD3, PACRG, SVIL, FGD4, WASF3, SYNE2, HOMER2, MYOZ3, MYPN"
GO:0032559,adenyl ribonucleotide binding,8.11e-10,"DHX30, CNGB1, ADCY10, JAK1, ABCA1, BLM, KIF26B, ACSF3, ABCF1, ABCA4, ABL1, KALRN, DDX58, ABL2, TAP2, ACACB, PAK2, MYO18B, IRAK4, BAZ1B, KCNJ1, ACTA2, PIP5K1A, PIP5K1B, RAPGEF2, SCP2, ALPK1, NLRP5, GAK, KIF9, KIFC3, MYO16, NLRP12, GALK2, ADCY2, PDE4D, CAMP, KIF4B, RIMKLB, ATAD2, HNRNPU, TTF2, ATAD2B, KIF11, SETX, SWAP70, VWA8, ALPK3, TEP1, NAT10, KIAA0232, KIAA0232, PDIK1L, PFAS, DGKI, SLC27A2, MYO3B, HCN1, DDX4, MAP3K13, ERBB4, ATP8A1, CAMK2A, PYGL, CDK14, ERCC3, RAD54L2, TEX14, ABCB1, SIK1, UBE2W, MCM9, LCK, MYH11, RAD51C, MAGI1, MYLK, ALK, RUNX1, TTLL12, MYO1D, HSP90AA1, MKNK1, MYO5B, MYO7A, MYO9A, EP400, MYO10, INO80, DHX37, TLK1, NME7, HIPK1, DDX46, CIT, STK32B, SBK2, ABCC11, DNAH17, ATP2C2, NLRC5, NARS2, ATP11A, HELZ, SGK3, RFC2, TUT1, TTLL6, MTHFD1L, IDE, TPK1, DNAJA4, OXSR1, DDX39B, EIF2AK4, LYN, ATP2C1, HUNK, FER, LONP1, ACBD4, PMS1, IQCA1, MAP4K5, THRAP3, ATP13A4, DGKG, DNAH11, CDC6, TNK1, FGFR2, ABCC3, PAK6, FGR, CDC42BPG, DNAH3, GRK5, IGF1R, CDK15, DNAH1, BMP2K, RIPK1, ABCC12, DHX9, WNK1, DHX15, MATK, NAV3, NEK11, FLT1, FLT4, AK3, SIK3, NWD1, GSK3A, DCAKD, SRC, NLRP2, HACL1, FARS2, ROCK2, RHO, NLK, ATP9A, RARS2, CDKL1, CLPB, ATP1A3, ATP1A4, MSH6, KIF23, CMPK1, CHD2, CCT6B, ATP2B1, MAP3K4, MAP3K5, UBE2D2, UBE2E2, EPHA10, ACSBG2, DDX50, DNA2, POLQ, ATP8A2, DNAH8, NTRK3, KIF6, ROR1, ROR2, ABCA13, DDR2, ATP6V1B1, CAMK1D, CIITA, N4BP2, PRKAR1A, CAMP, ATR, SYN3, PRKAR1B, CAMP, ABCA12, ATP9B, PRKCA, UCK2, AURKA, PRKCE, INSR, ADCK1, PRKCZ, PRKDC, MAP3K9, MAPK1, MAPK4, STK39, CDC42BPB, MAPK9, MAP2K1, MAP2K5, RRM1, TNK2, TNNI3K, MAST4, RYR1, DYRK1A, AATK"
GO:0030554,adenyl nucleotide binding,1.12e-09,"DHX30, CNGB1, ADCY10, JAK1, ABCA1, BLM, KIF26B, ACSF3, ABCF1, ABCA4, ABL1, KALRN, DDX58, ABL2, TAP2, ACACB, PAK2, MYO18B, IRAK4, BAZ1B, KCNJ1, ACTA2, PIP5K1A, PIP5K1B, RAPGEF2, SCP2, ALPK1, NLRP5, GAK, KIF9, KIFC3, MYO16, NLRP12, GALK2, ADCY2, GRPEL1, PDE4D, CAMP, KIF4B, RIMKLB, ATAD2, HNRNPU, TTF2, ATAD2B, KIF11, SETX, SWAP70, VWA8, ALPK3, TEP1, NAT10, KIAA0232, KIAA0232, PDIK1L, PFAS, DGKI, SLC27A2, MYO3B, HCN1, DDX4, MAP3K13, ERBB4, ATP8A1, CAMK2A, PYGL, CDK14, ERCC3, RAD54L2, TEX14, ABCB1, SIK1, UBE2W, MCM9, LCK, MYH11, RAD51C, MAGI1, MYLK, ALK, RUNX1, TTLL12, MYO1D, HSP90AA1, MKNK1, MYO5B, MYO7A, MYO9A, EP400, MYO10, INO80, DHX37, TLK1, NME7, HIPK1, DDX46, CIT, STK32B, SBK2, ABCC11, DNAH17, ATP2C2, NLRC5, NARS2, ATP11A, HELZ, SGK3, RFC2, TUT1, TTLL6, MTHFD1L, IDE, TPK1, DNAJA4, OXSR1, DDX39B, EIF2AK4, LYN, ATP2C1, HUNK, FER, LONP1, ACBD4, PMS1, IQCA1, MAP4K5, THRAP3, ATP13A4, DGKG, DNAH11, CDC6, TNK1, FGFR2, ABCC3, PAK6, FGR, CDC42BPG, DNAH3, GRK5, IGF1R, CDK15, DNAH1, BMP2K, RIPK1, ABCC12, DHX9, WNK1, DHX15, MATK, NAV3, NEK11, FLT1, FLT4, AK3, SIK3, NWD1, GSK3A, DCAKD, SRC, NLRP2, HACL1, FARS2, ROCK2, RHO, NLK, ATP9A, RARS2, CDKL1, CLPB, ATP1A3, ATP1A4, MSH6, KIF23, CMPK1, CHD2, CCT6B, ATP2B1, MAP3K4, MAP3K5, UBE2D2, UBE2E2, EPHA10, ACSBG2, DDX50, DNA2, POLQ, ATP8A2, DNAH8, NTRK3, KIF6, ROR1, ROR2, ABCA13, DDR2, ATP6V1B1, CAMK1D, CIITA, N4BP2, PRKAR1A, CAMP, ATR, SYN3, PRKAR1B, CAMP, ABCA12, ATP9B, PRKCA, UCK2, AURKA, PRKCE, INSR, ADCK1, PRKCZ, PRKDC, MAP3K9, MAPK1, MAPK4, STK39, CDC42BPB, MAPK9, MAP2K1, MAP2K5, RRM1, TNK2, TNNI3K, MAST4, RYR1, DYRK1A, AATK"
GO:0005524,ATP binding,1.17e-09,"DHX30, ADCY10, JAK1, ABCA1, BLM, KIF26B, ACSF3, ABCF1, ABCA4, ABL1, KALRN, DDX58, ABL2, TAP2, ACACB, PAK2, MYO18B, IRAK4, BAZ1B, KCNJ1, ACTA2, PIP5K1A, PIP5K1B, ALPK1, NLRP5, GAK, KIF9, KIFC3, MYO16, NLRP12, GALK2, ADCY2, KIF4B, RIMKLB, ATAD2, HNRNPU, TTF2, ATAD2B, KIF11, SETX, SWAP70, VWA8, ALPK3, TEP1, NAT10, KIAA0232, KIAA0232, PDIK1L, PFAS, DGKI, SLC27A2, MYO3B, DDX4, MAP3K13, ERBB4, ATP8A1, CAMK2A, PYGL, CDK14, ERCC3, RAD54L2, TEX14, ABCB1, SIK1, UBE2W, MCM9, LCK, MYH11, RAD51C, MAGI1, MYLK, ALK, RUNX1, TTLL12, MYO1D, HSP90AA1, MKNK1, MYO5B, MYO7A, MYO9A, EP400, MYO10, INO80, DHX37, TLK1, NME7, HIPK1, DDX46, CIT, STK32B, SBK2, ABCC11, DNAH17, ATP2C2, NLRC5, NARS2, ATP11A, HELZ, SGK3, RFC2, TUT1, TTLL6, MTHFD1L, IDE, TPK1, DNAJA4, OXSR1, DDX39B, EIF2AK4, LYN, ATP2C1, HUNK, FER, LONP1, PMS1, IQCA1, MAP4K5, THRAP3, ATP13A4, DGKG, DNAH11, CDC6, TNK1, FGFR2, ABCC3, PAK6, FGR, CDC42BPG, DNAH3, GRK5, IGF1R, CDK15, DNAH1, BMP2K, RIPK1, ABCC12, DHX9, WNK1, DHX15, MATK, NAV3, NEK11, FLT1, FLT4, AK3, SIK3, NWD1, GSK3A, DCAKD, SRC, NLRP2, HACL1, FARS2, ROCK2, RHO, NLK, ATP9A, RARS2, CDKL1, CLPB, ATP1A3, ATP1A4, MSH6, KIF23, CMPK1, CHD2, CCT6B, ATP2B1, MAP3K4, MAP3K5, UBE2D2, UBE2E2, EPHA10, ACSBG2, DDX50, DNA2, POLQ, ATP8A2, DNAH8, NTRK3, KIF6, ROR1, ROR2, ABCA13, DDR2, ATP6V1B1, CAMK1D, CIITA, N4BP2, ATR, SYN3, ABCA12, ATP9B, PRKCA, UCK2, AURKA, PRKCE, INSR, ADCK1, PRKCZ, PRKDC, MAP3K9, MAPK1, MAPK4, STK39, CDC42BPB, MAPK9, MAP2K1, MAP2K5, RRM1, TNK2, TNNI3K, MAST4, RYR1, DYRK1A, AATK"
GO:0043168,anion binding,1.22e-09,"DHX30, GNA14, SNX14, CNGB1, ADCY10, PADI4, ABAT, JAK1, ABCA1, BLM, KIF26B, ACSF3, PCSK6, ABCF1, PSD, MICAL2, ABCA4, PAFAH1B1, ABL1, KALRN, DDX58, ABL2, TAP2, ACACB, PAK2, MYO18B, HIP1R, IRAK4, BAZ1B, ACOX1, KCNH1, KCNJ1, ACTA2, RAB10, RAB10, PIP5K1A, PIP5K1B, NUGGC, HMGB1, RAPGEF2, SCP2, ALPK1, NLRP5, RRAGC, KCNQ1, ARL10, CRISPLD2, GAK, KIF9, MYO16, KIFC3, NLRP12, GALK2, ADCY2, RAB38, RAB38, PDE4D, CAMP, KIF4B, RIMKLB, ATAD2, NSFL1C, HNRNPU, GLTP, ARHGAP32, RAB3C, RAB3C, TTF2, ATAD2B, KIF11, SETX, SWAP70, VWA8, PLEKHA5, EPB41, ALPK3, TEP1, NAT10, PTPRS, KIAA0232, KIAA0232, GREM2, EXOC8, PDIK1L, PFAS, TUBB4A, OGFOD1, DGKI, SLC27A2, MYO3B, HCN1, ARAP3, DDX4, MAP3K13, ERBB4, ATP8A1, CAMK2A, PYGL, CDK14, PEMT, ERCC3, MX2, QDPR, SHC1, RAD54L2, TGFBR3, HRG, TEX14, WDFY1, RAB6A, RAB6A, RAB31, RAB31, ADAP1, LAMC2, ABCB1, TMEM184A, SIK1, UBE2W, MCM9, NCAN, PITPNM2, LBR, LCK, ACOXL, PLA2G2F, MYH11, RAD51C, GADL1, AGAP1, STAB1, MAGI1, GAB2, GRB2, C2CD5, MYLK, ALK, RUNX1, TTLL12, SLC1A1, MYO1D, HSP90AA1, MKNK1, MYO5B, MYO7A, EP400, MYO9A, RAP1B, RAP1B, MYO10, INO80, RARA, DHX37, FCHSD2, RNLS, TLK1, NME7, HIPK1, DDX46, AMPH, ADAMTS5, GMDS, RHOBTB1, RHO, COMMD1, PARD3B, SLC9A1, GNAL, CIT, STK32B, TECPR1, GNAQ, SBK2, UNC13B, ABCC11, DNAH17, CPNE5, MMAA, PLCB1, ATP2C2, NDUFAB1, GNL1, NLRC5, KCNAB1, ASTN2, NARS2, ATP11A, HELZ, SCARB1, SGK3, RFC2, SLIT3, TUT1, TTLL6, MTHFD1L, IDE, TPK1, APLP2, DNAJA4, OXSR1, CD44, DDX39B, APOB, EIF2AK4, LYN, ATP2C1, SLIT2, HUNK, RANBP17, NELL1, FER, LONP1, ACBD4, RAB28, RAB28, PMS1, FGF1, IQCA1, MAP4K5, THRAP3, ATP13A4, RIT2, DGKG, CPNE9, ZFYVE9, DNAH11, NR1H4, CDC6, CDC42, FGFR2, TNK1, ABCC3, PAK6, FGR, CDC42BPG, LIPG, DNAH3, GRK5, IGF1R, DUS3L, STAB2, CDK15, GBF1, DNAH1, GLRA3, RHOH, BMP2K, RIPK1, ABCC12, ARL2, POR, CPNE7, DHX9, WNK1, ZCCHC2, DHX15, MATK, NQO2, NAV3, MPPE1, PPARG, ARHGAP35, NEK11, FLT1, SIGLEC5, FLT4, GRM7, ASAP1, DAB2IP, AK3, SIK3, PLCZ1, NWD1, GSK3A, DCAKD, SPTBN1, EVA1C, SRC, NLRP2, SRD5A1, HACL1, FARS2, ROCK2, RHO, NLK, ATP9A, GNA13, RARS2, CDKL1, CLPB, ATP1A3, CPNE2, ATP1A4, MSH6, KIF23, CMPK1, CHD2, CCT6B, PRSS57, ATP2B1, MREG, LGR6, NRP1, MAP3K4, MAP3K5, UBE2D2, UBE2E2, EPHA10, ACSBG2, DDX50, DNA2, POLQ, GUCY1A2, SPTLC2, ATP8A2, DNAH8, NTRK3, KIF6, ROR1, ROR2, ABCA13, DDR2, RSPO4, ATP6V1B1, NUMA1, DNM2, CAMK1D, PTGES, CIITA, N4BP2, PRKAR1A, CAMP, DPEP1, RAB3D, RAB3D, ATR, PRKAR1B, CAMP, SYN3, HHAT, ABCA12, ATP9B, PRKCA, UCK2, SGPL1, AURKA, DPYD, PRKCE, INSR, ADCK1, PRKCZ, ST8SIA3, PRKDC, MAP3K9, COL25A1, MAPK1, MAPK4, PITPNC1, STK39, CDC42BPB, MAPK9, MAP2K1, ARL5A, EXOC1, MAP2K5, RRM1, PICALM, TNK2, TIRAP, SVIL, VDR, VEGFB, TNNI3K, MAST4, CLVS1, RYR1, RYR2, SYT1, PSD4, DYRK1A, TUBA4B, AATK"
GO:0097367,carbohydrate derivative binding,1.13e-08,"DHX30, GNA14, CNGB1, ADCY10, JAK1, ABCA1, BLM, KIF26B, ACSF3, PCSK6, ABCF1, ABCA4, PAFAH1B1, ABL1, KALRN, DDX58, ABL2, TAP2, DEFB119, ACACB, PAK2, MYO18B, IRAK4, BAZ1B, KCNJ1, ACTA2, RAB10, RAB10, PIP5K1A, PIP5K1B, NUGGC, HMGB1, RAPGEF2, SCP2, ALPK1, NLRP5, RRAGC, ARL10, ADA, CRISPLD2, GAK, KIF9, MYO16, KIFC3, NLRP12, GALK2, ADCY2, RAB38, RAB38, PDE4D, CAMP, KIF4B, RIMKLB, SULF2, ATAD2, HNRNPU, GLTP, RAB3C, RAB3C, TTF2, ATAD2B, KIF11, SETX, SWAP70, VWA8, ALPK3, TEP1, PTPRS, NAT10, KIAA0232, KIAA0232, GREM2, PDIK1L, PFAS, TUBB4A, DGKI, SLC27A2, MYO3B, HCN1, DDX4, MAP3K13, VIT, ERBB4, ATP8A1, CAMK2A, PYGL, CDK14, ERCC3, MX2, RAD54L2, TGFBR3, HRG, TEX14, RAB6A, RAB6A, RAB31, RAB31, LAMC2, ABCB1, TMEM184A, SIK1, UBE2W, MCM9, NCAN, LCK, MYH11, RAD51C, AGAP1, STAB1, MAGI1, MYLK, ALK, RUNX1, TTLL12, MYO1D, HSP90AA1, MKNK1, MYO5B, MYO7A, EP400, MYO9A, RAP1B, RAP1B, MYO10, INO80, DHX37, TLK1, NME7, HIPK1, DDX46, ADAMTS5, RHOBTB1, RHO, GNAL, CIT, STK32B, GNAQ, SBK2, ABCC11, DNAH17, MMAA, ATP2C2, GNL1, NLRC5, NARS2, ATP11A, HELZ, SCARB1, SGK3, RFC2, SLIT3, TUT1, TTLL6, MTHFD1L, IDE, TPK1, APLP2, DNAJA4, OXSR1, CD44, DDX39B, APOB, EIF2AK4, LYN, ATP2C1, SLIT2, HUNK, RANBP17, NELL1, FER, LONP1, ACBD4, RAB28, RAB28, PMS1, FGF1, IQCA1, MAP4K5, THRAP3, ATP13A4, RIT2, DGKG, DNAH11, CDC6, CDC42, FGFR2, TNK1, ABCC3, PAK6, FGR, CDC42BPG, LIPG, DNAH3, GRK5, IGF1R, STAB2, CDK15, DNAH1, RHOH, BMP2K, RIPK1, ABCC12, ARL2, POR, DHX9, WNK1, DHX15, MATK, NAV3, MPPE1, ARHGAP35, NEK11, FLT1, SIGLEC5, FLT4, AK3, SIK3, NWD1, GSK3A, DCAKD, EVA1C, SRC, NLRP2, HACL1, FARS2, ROCK2, RHO, NLK, ATP9A, GNA13, RARS2, CDKL1, CLPB, SPOCK3, ATP1A3, ATP1A4, MSH6, KIF23, CMPK1, CHD2, CCT6B, PRSS57, ATP2B1, LGR6, NRP1, MAP3K4, MAP3K5, UBE2D2, UBE2E2, EPHA10, ACSBG2, DDX50, DNA2, POLQ, GUCY1A2, ATP8A2, DNAH8, NTRK3, KIF6, ROR1, ROR2, ABCA13, DDR2, RSPO4, ATP6V1B1, DNM2, CAMK1D, CIITA, N4BP2, PRKAR1A, CAMP, DPEP1, RAB3D, RAB3D, ATR, PRKAR1B, CAMP, SYN3, HHAT, ABCA12, ATP9B, PRKCA, UCK2, AURKA, PRKCE, INSR, ADCK1, PRKCZ, ST8SIA3, PRKDC, MAP3K9, COL25A1, MAPK1, MAPK4, STK39, CDC42BPB, MAPK9, MAP2K1, ARL5A, MAP2K5, RRM1, TNK2, VEGFB, TNNI3K, MAST4, RYR1, DYRK1A, TUBA4B, AATK"
GO:0035639,purine ribonucleoside triphosphate binding,1.23e-08,"DHX30, GNA14, ADCY10, JAK1, ABCA1, BLM, KIF26B, ACSF3, ABCF1, ABCA4, ABL1, KALRN, DDX58, ABL2, TAP2, ACACB, PAK2, MYO18B, IRAK4, BAZ1B, KCNJ1, ACTA2, RAB10, RAB10, PIP5K1A, PIP5K1B, NUGGC, ALPK1, NLRP5, RRAGC, ARL10, GAK, KIF9, MYO16, KIFC3, NLRP12, GALK2, ADCY2, RAB38, RAB38, KIF4B, RIMKLB, ATAD2, HNRNPU, RAB3C, RAB3C, TTF2, ATAD2B, KIF11, SETX, SWAP70, VWA8, ALPK3, TEP1, NAT10, KIAA0232, KIAA0232, PDIK1L, PFAS, TUBB4A, DGKI, SLC27A2, MYO3B, DDX4, MAP3K13, ERBB4, ATP8A1, CAMK2A, PYGL, CDK14, ERCC3, MX2, RAD54L2, TEX14, RAB6A, RAB6A, RAB31, RAB31, ABCB1, SIK1, UBE2W, MCM9, LCK, MYH11, RAD51C, AGAP1, MAGI1, MYLK, ALK, RUNX1, TTLL12, MYO1D, HSP90AA1, MKNK1, MYO5B, MYO7A, EP400, MYO9A, RAP1B, RAP1B, MYO10, INO80, DHX37, TLK1, NME7, HIPK1, DDX46, RHOBTB1, RHO, GNAL, CIT, STK32B, GNAQ, SBK2, ABCC11, DNAH17, MMAA, ATP2C2, GNL1, NLRC5, NARS2, ATP11A, HELZ, SGK3, RFC2, TUT1, TTLL6, MTHFD1L, IDE, TPK1, DNAJA4, OXSR1, DDX39B, EIF2AK4, LYN, ATP2C1, HUNK, RANBP17, FER, LONP1, RAB28, RAB28, PMS1, IQCA1, MAP4K5, THRAP3, ATP13A4, RIT2, DGKG, DNAH11, CDC6, CDC42, FGFR2, TNK1, ABCC3, PAK6, FGR, CDC42BPG, DNAH3, GRK5, IGF1R, CDK15, DNAH1, RHOH, BMP2K, RIPK1, ABCC12, ARL2, DHX9, WNK1, DHX15, MATK, NAV3, ARHGAP35, NEK11, FLT1, FLT4, AK3, SIK3, NWD1, GSK3A, DCAKD, SRC, NLRP2, HACL1, FARS2, ROCK2, RHO, NLK, ATP9A, GNA13, RARS2, CDKL1, CLPB, ATP1A3, ATP1A4, MSH6, KIF23, CMPK1, CHD2, CCT6B, ATP2B1, MAP3K4, MAP3K5, UBE2D2, UBE2E2, EPHA10, ACSBG2, DDX50, DNA2, POLQ, GUCY1A2, ATP8A2, DNAH8, NTRK3, KIF6, ROR1, ROR2, ABCA13, DDR2, ATP6V1B1, DNM2, CAMK1D, CIITA, N4BP2, RAB3D, RAB3D, ATR, SYN3, HHAT, ABCA12, ATP9B, PRKCA, UCK2, AURKA, PRKCE, INSR, ADCK1, PRKCZ, PRKDC, MAP3K9, MAPK1, MAPK4, STK39, CDC42BPB, MAPK9, MAP2K1, ARL5A, MAP2K5, RRM1, TNK2, TNNI3K, MAST4, RYR1, DYRK1A, TUBA4B, AATK"
